,CODIGO_IES,NOME_IES,SIGLA_IES,TIPO_CATEGORIA_ADM,TIPO_ORG_ACADEMICA,REGIAO,UF
1839,14408,"INSTITUTO FEDERAL DE EDUCAÇÃO, CIENCIA E TECNOLOGIA DE BRASILIA",IFB,Pública Federal,"Instituto Federal de Educação, Ciência e Tecnologia",Centro-Oeste,Distrito Federal
1840,14412,FACULDADE DE TECNOLOGIA SENAI PERNAMBUCO,,Privada sem fins lucrativos,Faculdade,Nordeste,Pernambuco
1841,18258,FACULDADE UNIFICADA DO ESTADO DE SÃO PAULO,FAUESP,Privada com fins lucrativos,Faculdade,Sudeste,São Paulo
1842,14869,Faculdade Faipe,,Privada com fins lucrativos,Faculdade,Centro-Oeste,Mato Grosso
1843,14860,FACULDADE TECNOLÓGICA DENTAL CEEO,ESD-CEEO,Privada com fins lucrativos,Faculdade,Sul,Rio Grande do Sul
1844,13897,FACULDADE LABORO,Laboro,Privada com fins lucrativos,Faculdade,Nordeste,Maranhão
1845,14509,"INSTITUTO FEDERAL DE EDUCAÇÃO, CIÊNCIA E TECNOLOGIA BAIANO",IFBAIANO,Pública Federal,"Instituto Federal de Educação, Ciência e Tecnologia",Nordeste,Bahia
1846,14727,FACULDADE PROGRESSO,FAP,Privada com fins lucrativos,Faculdade,Sudeste,São Paulo
1847,14622,FACULDADES INTEGRADAS DE SERGIPE,FISE,Privada com fins lucrativos,Faculdade,Nordeste,Sergipe
1848,15451,Faculdade de Direito de Ipatinga,FADIPA,Privada sem fins lucrativos,Faculdade,Sudeste,Minas Gerais
1849,14715,FACULDADE PIAGET,FACPIAGET,Privada sem fins lucrativos,Faculdade,Sudeste,São Paulo
1850,15236,FACULDADE DE TECNOLOGIA ALCIDES MAYA,AMTEC,Privada com fins lucrativos,Faculdade,Sul,Rio Grande do Sul
1851,14724,"INSTITUTO FEDERAL DE EDUCAÇÃO, CIÊNCIA E TECNOLOGIA DO PARANÁ",IFPR,Pública Federal,"Instituto Federal de Educação, Ciência e Tecnologia",Sul,Paraná
1852,1807,"INSTITUTO FEDERAL DE EDUCAÇÃO, CIÊNCIA E TECNOLOGIA DO CEARÁ",IFCE,Pública Federal,"Instituto Federal de Educação, Ciência e Tecnologia",Nordeste,Ceará
1853,5,UNIVERSIDADE FEDERAL DO PIAUÍ,UFPI,Pública Federal,Universidade,Nordeste,Piauí
1854,2156,FACULDADE SÃO TOMÁS DE AQUINO,FACESTA,Privada sem fins lucrativos,Faculdade,Nordeste,Alagoas
1855,3984,FUNDAÇÃO UNIVERSIDADE FEDERAL DO VALE DO SÃO FRANCISCO,UNIVASF,Pública Federal,Universidade,Nordeste,Pernambuco
1856,1811,"INSTITUTO FEDERAL DE EDUCAÇÃO, CIÊNCIA E TECNOLOGIA DE GOIÁS",IFG,Pública Federal,"Instituto Federal de Educação, Ciência e Tecnologia",Centro-Oeste,Goiás
1857,1808,"INSTITUTO FEDERAL DE EDUCAÇÃO, CIÊNCIA E TECNOLOGIA DO ESPÍRITO SANTO",IFES,Pública Federal,"Instituto Federal de Educação, Ciência e Tecnologia",Sudeste,Espírito Santo
1858,2484,FACULDADE PROCESSUS,PFD,Privada sem fins lucrativos,Faculdade,Centro-Oeste,Distrito Federal
1859,1810,"INSTITUTO FEDERAL DE EDUCAÇÃO, CIÊNCIA E TECNOLOGIA DE SÃO PAULO",IFSP,Pública Federal,"Instituto Federal de Educação, Ciência e Tecnologia",Sudeste,São Paulo
1860,4699,FACULDADE NOROESTE,FAN,Privada com fins lucrativos,Faculdade,Centro-Oeste,Goiás
1861,15894,SOBRESP - Faculdade de Ciências da Saúde,SOBRESP,Privada com fins lucrativos,Faculdade,Sul,Rio Grande do Sul
1862,14890,FACULDADE PRAIA GRANDE,FPG,Privada com fins lucrativos,Faculdade,Sudeste,São Paulo
1863,14901,FACULDADE INTEGRADA CARAJÁS,FIC,Privada com fins lucrativos,Faculdade,Norte,Pará
1864,11902,FACULDADE DE TECNOLOGIA E DESENVOLVIMENTO DE COMPETÊNCIAS,FDC,Privada com fins lucrativos,Faculdade,Norte,Pará
1865,22317,Escola Superior da Amazônia de Abaetetuba,ESAMAZ,Privada com fins lucrativos,Faculdade,Norte,Pará
1866,14879,FACULDADE DOURADO,FD,Privada com fins lucrativos,Faculdade,Sudeste,São Paulo
1867,14882,FACULDADE HORIZONTE,FACHORIZONTE,Privada com fins lucrativos,Faculdade,Centro-Oeste,Distrito Federal
1868,349,CENTRO UNIVERSITÁRIO DE BELO HORIZONTE,UNI-BH,Privada com fins lucrativos,Centro Universitário,Sudeste,Minas Gerais
1869,2564,UNIVERSIDADE FEDERAL DE CAMPINA GRANDE,UFCG,Pública Federal,Universidade,Nordeste,Paraíba
1870,14927,FACULDADE SÃO GABRIEL DA PALHA,FASG,Privada com fins lucrativos,Faculdade,Sudeste,Espírito Santo
1871,15135,FACULDADE DE TECNOLOGIA SENAC AMAZONAS,,Privada sem fins lucrativos,Faculdade,Norte,Amazonas
1872,14951,FACULDADE DE ENGENHARIA E INOVAÇÃO TÉCNICO PROFISSI,FEITEP,Privada com fins lucrativos,Faculdade,Sul,Paraná
1873,14969,FACULDADE DE TECNOLOGIA EM SAÚDE,FATESA,Privada com fins lucrativos,Faculdade,Sudeste,São Paulo
1874,1946,FACULDADE LEGALE,FALEG,Privada com fins lucrativos,Faculdade,Sudeste,São Paulo
1875,14975,FACULDADE DO NORDESTE DA BAHIA,FANEB,Privada com fins lucrativos,Faculdade,Nordeste,Bahia
1876,1945,FACULDADE DE SORRISO,,Privada com fins lucrativos,Faculdade,Centro-Oeste,Mato Grosso
1877,22145,Faculdade de Ciências Jurídicas de Erechim,,Privada com fins lucrativos,Faculdade,Sul,Rio Grande do Sul
1878,1847,FACULDADE PITÁGORAS DE IMPERATRIZ,,Privada com fins lucrativos,Faculdade,Nordeste,Maranhão
1879,22149,Faculdade de Ciências Jurídicas de Franca,,Privada com fins lucrativos,Faculdade,Sudeste,São Paulo
1880,19256,Faculdade Pitágoras de Brumado,,Privada com fins lucrativos,Faculdade,Nordeste,Bahia
1881,1774,FACULDADE EDUCACIONAL DE PONTA GROSSA,,Privada com fins lucrativos,Faculdade,Sul,Paraná
1882,22128,Faculdade de Ciências Jurídicas de Campina Grande,,Privada com fins lucrativos,Faculdade,Nordeste,Paraíba
1883,4959,FACULDADE PITÁGORAS DE FEIRA DE SANTANA,,Privada com fins lucrativos,Faculdade,Nordeste,Bahia
1884,780,UNIVERSIDADE DE CUIABÁ,UNIC/UNIME,Privada com fins lucrativos,Universidade,Centro-Oeste,Mato Grosso
1885,736,FACULDADE PITÁGORAS DE LINHARES,,Privada com fins lucrativos,Faculdade,Sudeste,Espírito Santo
1886,18628,Faculdade Pitágoras de Luis Eduardo Magalhães,,Privada com fins lucrativos,Faculdade,Nordeste,Bahia
1887,1502,FACULDADE ANHANGUERA PITÁGORAS DE JUNDIAÍ,,Privada com fins lucrativos,Faculdade,Sudeste,São Paulo
1888,1492,FACULDADE PITÁGORAS DE UBERLÂNDIA,PIT UBERLÂNDIA,Privada com fins lucrativos,Faculdade,Sudeste,Minas Gerais
1889,1452,FACULDADE PITÁGORAS DO MARANHÃO,,Privada com fins lucrativos,Faculdade,Nordeste,Maranhão
1890,22153,Faculdade de Ciências Jurídicas de Guanambi,,Privada com fins lucrativos,Faculdade,Nordeste,Bahia
1891,22229,Faculdade de Ciências Jurídicas de Itapeva,,Privada com fins lucrativos,Faculdade,Sudeste,São Paulo
1892,22228,Faculdade de Ciências Jurídicas de Catanduva,,Privada com fins lucrativos,Faculdade,Sudeste,São Paulo
1893,22227,Faculdade de Ciências Jurídicas de Alagoinhas,,Privada com fins lucrativos,Faculdade,Nordeste,Bahia
1894,22226,Faculdade de Ciências Jurídicas de Paragominas,,Privada com fins lucrativos,Faculdade,Norte,Pará
1895,22225,Faculdade de Ciências Jurídicas de Eunápolis,,Privada com fins lucrativos,Faculdade,Nordeste,Bahia
1896,22124,Faculdade de Ciências Jurídicas de Brumado,,Privada com fins lucrativos,Faculdade,Nordeste,Bahia
1897,22152,Faculdade de Ciências Jurídicas de Santo Antônio de Jesus,,Privada com fins lucrativos,Faculdade,Nordeste,Bahia
1898,22151,Faculdade de Ciências Jurídicas de Rio Branco,,Privada com fins lucrativos,Faculdade,Norte,Acre
1899,22150,Faculdade de Ciências Jurídicas de Ribeirão das Neves,,Privada com fins lucrativos,Faculdade,Sudeste,Minas Gerais
1900,22147,Faculdade de Ciências Jurídicas de Belo Jardim,,Privada com fins lucrativos,Faculdade,Nordeste,Pernambuco
1901,22144,Faculdade de Ciências Jurídicas de Luziânia,,Privada com fins lucrativos,Faculdade,Centro-Oeste,Goiás
1902,22140,Faculdade de Ciências Jurídicas de Uruguaiana,,Privada com fins lucrativos,Faculdade,Sul,Rio Grande do Sul
1903,22136,Faculdade de Ciências Jurídicas de Itabira,,Privada com fins lucrativos,Faculdade,Sudeste,Minas Gerais
1904,22135,Faculdade de Ciências Jurídicas de Irecê,,Privada com fins lucrativos,Faculdade,Nordeste,Bahia
1905,22134,Faculdade de Ciências Jurídicas de Serra,,Privada com fins lucrativos,Faculdade,Sudeste,Espírito Santo
1906,22129,Faculdade de Ciências Jurídicas de Juiz de Fora,,Privada com fins lucrativos,Faculdade,Sudeste,Minas Gerais
1907,22127,Faculdade de Ciências Jurídicas de Jequié,,Privada com fins lucrativos,Faculdade,Nordeste,Bahia
1908,22126,Faculdade de Ciências Jurídicas de Marabá,,Privada com fins lucrativos,Faculdade,Norte,Pará
1909,22125,Faculdade de Ciências Jurídicas de Bom Jesus da Lapa,,Privada com fins lucrativos,Faculdade,Nordeste,Bahia
1910,22123,Faculdade de Ciências Jurídicas de Arapiraca,,Privada com fins lucrativos,Faculdade,Nordeste,Alagoas
1911,21900,Faculdade Anhanguera de Catanduva,,Privada com fins lucrativos,Faculdade,Sudeste,São Paulo
1912,21691,Faculdade Pitágoras Belo Jardim,,Privada com fins lucrativos,Faculdade,Nordeste,Pernambuco
1913,21687,Faculdade Pitágoras Itabira,,Privada com fins lucrativos,Faculdade,Sudeste,Minas Gerais
1914,2576,FACULDADES PITÁGORAS UNIDADE GUARAPARI,FIPAG,Privada com fins lucrativos,Faculdade,Sudeste,Espírito Santo
1915,21553,Faculdade Pitágoras de Santo Antônio de Jesus,,Privada com fins lucrativos,Faculdade,Nordeste,Bahia
1916,21552,Faculdade Pitágoras de Rio Branco,,Privada com fins lucrativos,Faculdade,Norte,Acre
1917,21693,Faculdade Anhanguera Franca,,Privada com fins lucrativos,Faculdade,Sudeste,São Paulo
1918,1305,"FACULDADE DE CIÊNCIAS JURÍDICAS, GERENCIAIS E EDUCAÇÃO DE SINOP",,Privada com fins lucrativos,Faculdade,Centro-Oeste,Mato Grosso
1919,21281,Faculdade Pitágoras de Luziânia,,Privada com fins lucrativos,Faculdade,Centro-Oeste,Goiás
1920,21280,Faculdade Pitágoras de Alagoinhas,,Privada com fins lucrativos,Faculdade,Nordeste,Bahia
1921,21239,Faculdade Anhanguera de Jaú,,Privada com fins lucrativos,Faculdade,Sudeste,São Paulo
1922,2511,FACULDADE DE DIREITO UNIDADE GUARAPARI,FADIG,Privada com fins lucrativos,Faculdade,Sudeste,Espírito Santo
1923,19298,Faculdade Pitagoras de Eunapolis,,Privada com fins lucrativos,Faculdade,Nordeste,Bahia
1924,19787,Faculdade Pitágoras de Tucuruí,,Privada com fins lucrativos,Faculdade,Norte,Pará
1925,20588,Faculdade Anhanguera de Uruguaiana,,Privada com fins lucrativos,Faculdade,Sul,Rio Grande do Sul
1926,20587,Faculdade Pitágoras de Irecê,,Privada com fins lucrativos,Faculdade,Nordeste,Bahia
1927,20574,Faculdade Anhanguera de Nova Iguaçu,,Privada com fins lucrativos,Faculdade,Sudeste,Rio de Janeiro
1928,19791,Faculdade Pitágoras de Jaboatão dos Guararapes,,Privada com fins lucrativos,Faculdade,Nordeste,Pernambuco
1929,298,UNIVERSIDADE PITÁGORAS UNOPAR,,Privada com fins lucrativos,Universidade,Sul,Paraná
1930,2437,FACULDADE PITÁGORAS DE TEIXEIRA DE FREITAS,PIT TEIXEIRA,Privada com fins lucrativos,Faculdade,Nordeste,Bahia
1931,19788,Faculdade Pitágoras de Parauapebas,,Privada com fins lucrativos,Faculdade,Norte,Pará
1932,19786,Faculdade Pitágoras da Serra,,Privada com fins lucrativos,Faculdade,Sudeste,Espírito Santo
1933,19785,Faculdade Pitágoras de Ribeirão das Neves,,Privada com fins lucrativos,Faculdade,Sudeste,Minas Gerais
1934,19783,Faculdade Pitágoras de Paragominas,,Privada com fins lucrativos,Faculdade,Norte,Pará
1935,19781,Faculdade Pitágoras de Juiz de Fora,,Privada com fins lucrativos,Faculdade,Sudeste,Minas Gerais
1936,19780,Faculdade Pitágoras de Guanambi,,Privada com fins lucrativos,Faculdade,Nordeste,Bahia
1937,19323,Faculdade Pitagoras de Maraba,,Privada com fins lucrativos,Faculdade,Norte,Pará
1938,19272,Faculdade Pitagoras de Campina Grande,,Privada com fins lucrativos,Faculdade,Nordeste,Paraíba
1939,19260,Faculdade Pitágoras de Jequié,,Privada com fins lucrativos,Faculdade,Nordeste,Bahia
1940,19255,Faculdade Pitágoras de Bom Jesus da Lapa,,Privada com fins lucrativos,Faculdade,Nordeste,Bahia
1941,22143,Faculdade de Ciências Jurídicas de São José do Rio Preto,,Privada com fins lucrativos,Faculdade,Sudeste,São Paulo
1942,2773,FACULDADE DE MACAPÁ,,Privada com fins lucrativos,Faculdade,Norte,Amapá
1943,1233,CENTRO UNIVERSITÁRIO UNIC,,Privada com fins lucrativos,Centro Universitário,Centro-Oeste,Mato Grosso
1944,2264,FACULDADE DE COMUNICAÇÃO PITÁGORAS UNIDADE GUARAPARI,PIT GUARAPARI,Privada com fins lucrativos,Faculdade,Sudeste,Espírito Santo
1945,18627,Faculdade Pitágoras de João Pessoa,,Privada com fins lucrativos,Faculdade,Nordeste,Paraíba
1946,18626,Faculdade Pitágoras de Arapiraca,,Privada com fins lucrativos,Faculdade,Nordeste,Alagoas
1947,18625,Faculdade Pitágoras de Vitória da Conquista,,Privada com fins lucrativos,Faculdade,Nordeste,Bahia
1948,21554,Faculdade Anhanguera de Itapeva,,Privada com fins lucrativos,Faculdade,Sudeste,São Paulo
1949,22130,Faculdade de Ciências Jurídicas de Tucuruí,,Privada com fins lucrativos,Faculdade,Norte,Pará
1950,14996,FACULDADE DE GESTAO E NEGOCIOS DE SALVADOR,FGN,Privada com fins lucrativos,Faculdade,Nordeste,Bahia
1951,15015,Universidade Estadual do Norte do Paraná,UENP,Pública Estadual,Universidade,Sul,Paraná
1952,15032,UNIVERSIDADE ALTO VALE DO RIO DO PEIXE,UNIARP,Privada sem fins lucrativos,Universidade,Sul,Santa Catarina
1953,1614,FACULDADE ASTORGA,FAAST,Privada sem fins lucrativos,Faculdade,Sul,Paraná
1954,3610,Centro Universitário ICESP,Unicesp,Privada com fins lucrativos,Centro Universitário,Centro-Oeste,Distrito Federal
1955,15059,UNIVERSIDADE FEDERAL DO OESTE DO PARÁ,UFOPA,Pública Federal,Universidade,Norte,Pará
1956,582,UNIVERSIDADE FEDERAL DE SANTA MARIA,UFSM,Pública Federal,Universidade,Sul,Rio Grande do Sul
1957,15079,FACULDADE MASTER DE PARAUAPEBAS - FAMAP,FAMAP,Privada com fins lucrativos,Faculdade,Norte,Pará
1958,15121,UNIVERSIDADE FEDERAL DA FRONTEIRA SUL,UFFS,Pública Federal,Universidade,Sul,Santa Catarina
1959,852,FACULDADE DE INFORMÁTICA E ADMINISTRAÇÃO PAULISTA,FIAP,Privada com fins lucrativos,Faculdade,Sudeste,São Paulo
1960,15133,FACULDADE JARDINS,FACJARDINS,Privada com fins lucrativos,Faculdade,Nordeste,Sergipe
1961,17460,FACULDADE Profissional,FAPRO,Privada com fins lucrativos,Faculdade,Sul,Paraná
1962,4785,INSTITUTO FEDERAL DE EDUCAÇÃO CIÊNCIA E TECNOLOGIA DE RONDÔNIA,IFRO,Pública Federal,"Instituto Federal de Educação, Ciência e Tecnologia",Norte,Rondônia
1963,5322,FUNDAÇÃO UNIVERSIDADE FEDERAL DO PAMPA - UNIPAMPA,UNIPAMPA,Pública Federal,Universidade,Sul,Rio Grande do Sul
1964,584,UNIVERSIDADE FEDERAL DE GOIÁS,UFG,Pública Federal,Universidade,Centro-Oeste,Goiás
1965,1190,FACULDADE INTEGRAL CANTAREIRA,F.I.C.,Privada sem fins lucrativos,Faculdade,Sudeste,São Paulo
1966,15272,"FACULDADE DE TECNOLOGIA, EDUCAÇÃO SUPERIOR E PROFISSIONAL",FATESP,Privada com fins lucrativos,Faculdade,Nordeste,Piauí
1967,4090,FACULDADE DE ROSEIRA,FARO,Privada com fins lucrativos,Faculdade,Sudeste,São Paulo
1968,1308,FACULDADE NOVO MILÊNIO,FNM,Privada com fins lucrativos,Faculdade,Sudeste,Espírito Santo
1969,15382,Faculdade Noroeste do Mato Grosso,AJES,Privada com fins lucrativos,Faculdade,Centro-Oeste,Mato Grosso
1970,18631,FACULDADE DO VALE DO RIO ARINOS,AJES,Privada com fins lucrativos,Faculdade,Centro-Oeste,Mato Grosso
1971,17118,Faculdade do Norte de Mato Grosso,AJES,Privada com fins lucrativos,Faculdade,Centro-Oeste,Mato Grosso
1972,1661,Faculdade Projeção de Sobradinho,FAPRO,Privada sem fins lucrativos,Faculdade,Centro-Oeste,Distrito Federal
1973,1507,FACULDADE PROJEÇÃO DE CEILÂNDIA,FAPRO,Privada sem fins lucrativos,Faculdade,Centro-Oeste,Distrito Federal
1974,1309,Faculdade Projeção de Taguatinga Norte,FAPRO,Privada com fins lucrativos,Faculdade,Centro-Oeste,Distrito Federal
1975,15922,Faculdade Bíblica das Assembléias de Deus,,Privada sem fins lucrativos,Faculdade,Sudeste,São Paulo
1976,15383,FACULDADE PARA O DESENVOLVIMENTO SUSTENTÁVEL DA AMAZÔNIA,FADESA,Privada com fins lucrativos,Faculdade,Norte,Pará
1977,15433,FACULDADE CATÓLICA DE MATO GROSSO,FACC-MT,Privada sem fins lucrativos,Faculdade,Centro-Oeste,Mato Grosso
1978,5013,CENTRO UNIVERSITÁRIO ESTADUAL DA ZONA OESTE,UEZO,Pública Estadual,Centro Universitário,Sudeste,Rio de Janeiro
1979,20340,FACULDADE PAULISTA DE CIÊNCIAS DA SAÚDE,FPCS,Privada sem fins lucrativos,Faculdade,Sudeste,São Paulo
1980,15504,FACULDADE IRECÊ,FAI,Privada com fins lucrativos,Faculdade,Nordeste,Bahia
1981,15507,"Instituto Federal de Educação, Ciência e Tecnologia do Acre",IFAC,Pública Federal,"Instituto Federal de Educação, Ciência e Tecnologia",Norte,Acre
1982,3252,FACULDADE QUIRINÓPOLIS,FAQUI,Privada com fins lucrativos,Faculdade,Centro-Oeste,Goiás
1983,15520,"INSTITUTO FEDERAL DE EDUCAÇÃO, CIÊNCIA E TECNOLOGIA DE MATO GROSSO DO SUL",IFMS,Pública Federal,"Instituto Federal de Educação, Ciência e Tecnologia",Centro-Oeste,Mato Grosso do Sul
1984,15521,FACULDADE CATÓLICA DE SÃO JOSÉ DOS CAMPOS,CATÓLICA-SJC,Privada sem fins lucrativos,Faculdade,Sudeste,São Paulo
1985,15522,"INSTITUTO FEDERAL DE EDUCAÇÃO, CIÊNCIA E TECNOLOGIA DO AMAPÁ",IFAP,Pública Federal,"Instituto Federal de Educação, Ciência e Tecnologia",Norte,Amapá
1986,15526,FACULDADE DE GESTAO E NEGOCIOS DE FORTALEZA,FGNF,Privada com fins lucrativos,Faculdade,Nordeste,Ceará
1987,1857,FACULDADE DEHONIANA,DEHONIANA,Privada sem fins lucrativos,Faculdade,Sudeste,São Paulo
1988,2462,FACULDADE SÃO LUÍS,FSL,Privada sem fins lucrativos,Faculdade,Sul,Santa Catarina
1989,1714,ESCOLA SUPERIOR DE GESTÃO COMERCIAL E MARKETING,ESIC,Privada sem fins lucrativos,Faculdade,Sul,Paraná
1990,595,UNIVERSIDADE FEDERAL DE ALFENAS,UNIFAL-MG,Pública Federal,Universidade,Sudeste,Minas Gerais
1991,15562,Faculdade Batista do Cariri,FBC,Privada sem fins lucrativos,Faculdade,Nordeste,Ceará
1992,15,UNIVERSIDADE CATÓLICA DE PETRÓPOLIS,UCP,Privada sem fins lucrativos,Universidade,Sudeste,Rio de Janeiro
1993,16037,Instituto Superior de Ciencias Policiais,ISCP,Pública Federal,Faculdade,Centro-Oeste,Distrito Federal
1994,15839,Faculdade Pitágoras da Paraíba,,Privada com fins lucrativos,Faculdade,Nordeste,Paraíba
1995,1326,FACULDADE CAPIXABA DA SERRA,MULTIVIX SERRA,Privada com fins lucrativos,Faculdade,Sudeste,Espírito Santo
1996,15859,Faculdade Católica Paulista,FACAP,Privada sem fins lucrativos,Faculdade,Sudeste,São Paulo
1997,15873,Faculdade Itaquá,UNEITAQUÁ,Privada com fins lucrativos,Faculdade,Sudeste,São Paulo
1998,15980,FG Faculdade Global,FG,Privada com fins lucrativos,Faculdade,Sul,Rio Grande do Sul
1999,1653,FACULDADE DE CIÊNCIA E EDUCAÇÃO DO CAPARAÓ,FACEC,Privada com fins lucrativos,Faculdade,Sudeste,Espírito Santo
2000,16194,Faculdade Gran Tietê,FGT,Privada com fins lucrativos,Faculdade,Sudeste,São Paulo
2001,16245,FACULDADE ESCOLA DE NEGÓCIOS EXCELLENCE,FAENE,Privada com fins lucrativos,Faculdade,Nordeste,Maranhão
2002,583,UNIVERSIDADE FEDERAL DO CEARÁ,UFC,Pública Federal,Universidade,Nordeste,Ceará
2003,2770,FACULDADE UNIDA DE CAMPINAS,FACUNICAMPS,Privada com fins lucrativos,Faculdade,Centro-Oeste,Goiás
2004,597,UNIVERSIDADE FEDERAL DO TRIÂNGULO MINEIRO,UFTM,Pública Federal,Universidade,Sudeste,Minas Gerais
2005,16502,FACULDADE PESTALOZZI DE FRANCA,FAPESF,Privada sem fins lucrativos,Faculdade,Sudeste,São Paulo
2006,2098,FACULDADE EXCELÊNCIA,FAEX,Privada sem fins lucrativos,Faculdade,Nordeste,Ceará
2007,2133,"Faculdade de Ciências, Educação e Teologia do Norte do Brasil",FACETEN,Privada sem fins lucrativos,Faculdade,Norte,Roraima
2008,16525,FACULDADE DUARTE COELHO,FDC,Privada com fins lucrativos,Faculdade,Nordeste,Pernambuco
2009,16543,Faculdade Metropolitana do Estado de São Paulo,FAMEESP,Privada com fins lucrativos,Faculdade,Sudeste,São Paulo
2010,16628,Faculdade ANASPS,FANASPS,Privada sem fins lucrativos,Faculdade,Centro-Oeste,Distrito Federal
2011,3849,FUNDAÇÃO UNIVERSIDADE FEDERAL DO TOCANTINS,UFT,Pública Federal,Universidade,Norte,Tocantins
2012,16654,FACULDADE UNIRB - SERRINHA,FACULDADE UNIRB,Privada com fins lucrativos,Faculdade,Nordeste,Bahia
2013,17438,Faculdade Católica Cavanis do Sudoeste do Pará,FCCSP,Privada sem fins lucrativos,Faculdade,Norte,Pará
2014,569,UNIVERSIDADE FEDERAL DO PARÁ,UFPA,Pública Federal,Universidade,Norte,Pará
2015,16691,Faculdade NETCOM,FANET,Privada com fins lucrativos,Faculdade,Nordeste,Maranhão
2016,575,UNIVERSIDADE FEDERAL DE MINAS GERAIS,UFMG,Pública Federal,Universidade,Sudeste,Minas Gerais
2017,1578,"INSTITUTO FEDERAL DE EDUCAÇÃO, CIÊNCIA E TECNOLOGIA SUL-RIO-GRANDENSE",IFSul,Pública Federal,"Instituto Federal de Educação, Ciência e Tecnologia",Sul,Rio Grande do Sul
2018,16728,"FACULDADE DE CIÊNCIAS HUMANAS, ECONÔMICAS E DA SAÚDE",FAHESA/ITPAC PALMAS,Privada com fins lucrativos,Faculdade,Norte,Tocantins
2019,16725,Faculdade de Educacao e Tecnologia do Para,FAETE,Privada sem fins lucrativos,Faculdade,Norte,Pará
2020,3160,"INSTITUTO FEDERAL DE EDUCAÇÃO, CIÊNCIA E TECNOLOGIA DE ALAGOAS",IFAL,Pública Federal,"Instituto Federal de Educação, Ciência e Tecnologia",Nordeste,Alagoas
2021,586,UNIVERSIDADE FEDERAL DO RIO DE JANEIRO,UFRJ,Pública Federal,Universidade,Sudeste,Rio de Janeiro
2022,580,UNIVERSIDADE FEDERAL DE PERNAMBUCO,UFPE,Pública Federal,Universidade,Nordeste,Pernambuco
2023,16782,Faculdade Mário Quintana,FAMAQUI,Privada com fins lucrativos,Faculdade,Sul,Rio Grande do Sul
2024,16816,Faculdade de Ensino Superior do  Sul do Pará,FESSULPA,Privada com fins lucrativos,Faculdade,Norte,Pará
2025,16864,Faculdade Cultura Inglesa,FCI,Privada sem fins lucrativos,Faculdade,Sudeste,São Paulo
2026,16879,Faculdade de Medicina de Olinda,FMO,Privada com fins lucrativos,Faculdade,Nordeste,Pernambuco
2027,16898,FACULDADE DE EDUCAÇÃO E TECNOLOGIA DA AMAZÔNIA,FAM,Privada com fins lucrativos,Faculdade,Norte,Pará
2028,16943,FACULDADE UNINASSAU PARNAMIRIM,,Privada com fins lucrativos,Faculdade,Nordeste,Rio Grande do Norte
2029,16901,INSTITUTO EDUCATIE,EDUCATIE,Privada com fins lucrativos,Faculdade,Sudeste,São Paulo
2030,16918,FACULDADE CATÓLICA DE FEIRA DE SANTANA,,Privada sem fins lucrativos,Faculdade,Nordeste,Bahia
2031,1893,Faculdade Unirb - Feira de Santana,F. UNIRB,Privada com fins lucrativos,Faculdade,Nordeste,Bahia
2032,1968,FACULDADE BRASILEIRA DE TECNOLOGIA,FBT,Privada com fins lucrativos,Faculdade,Nordeste,Sergipe
2033,16934,Faculdade Melies de Tecnologia,Melies,Privada com fins lucrativos,Faculdade,Sudeste,São Paulo
2034,16948,Faculdade 28 de Agosto de Ensino e Pesquisa,28 de Agosto,Privada sem fins lucrativos,Faculdade,Sudeste,São Paulo
2035,16964,Faculdade de Tecnologia de Horizonte,FATHOR,Privada com fins lucrativos,Faculdade,Nordeste,Ceará
2036,16967,FACULDADE SENAI RIO,,Privada sem fins lucrativos,Faculdade,Sudeste,Rio de Janeiro
2037,4504,FUNDAÇÃO UNIVERSIDADE FEDERAL DA GRANDE DOURADOS,UFGD,Pública Federal,Universidade,Centro-Oeste,Mato Grosso do Sul
2038,699,FUNDAÇÃO UNIVERSIDADE FEDERAL DE RONDÔNIA,UNIR,Pública Federal,Universidade,Norte,Rondônia
2039,8,UNIVERSIDADE FEDERAL DE VIÇOSA,UFV,Pública Federal,Universidade,Sudeste,Minas Gerais
2040,572,UNIVERSIDADE FEDERAL FLUMINENSE,UFF,Pública Federal,Universidade,Sudeste,Rio de Janeiro
2041,579,UNIVERSIDADE FEDERAL DA PARAÍBA,UFPB,Pública Federal,Universidade,Nordeste,Paraíba
2042,573,UNIVERSIDADE FEDERAL DO ESPÍRITO SANTO,UFES,Pública Federal,Universidade,Sudeste,Espírito Santo
2043,585,UNIVERSIDADE FEDERAL DE SANTA CATARINA,UFSC,Pública Federal,Universidade,Sul,Santa Catarina
2044,578,UNIVERSIDADE FEDERAL DA BAHIA,UFBA,Pública Federal,Universidade,Nordeste,Bahia
2045,571,UNIVERSIDADE FEDERAL DO PARANÁ,UFPR,Pública Federal,Universidade,Sul,Paraná
2046,12,UNIVERSIDADE FEDERAL DO RIO GRANDE,FURG,Pública Federal,Universidade,Sul,Rio Grande do Sul
2047,19793,FACULDADE FADAM DE MARACANAÚ,FADAM,Privada com fins lucrativos,Faculdade,Nordeste,Ceará
2048,17688,FACULDADE FADAM,FADAM,Privada com fins lucrativos,Faculdade,Nordeste,Ceará
2049,587,UNIVERSIDADE FEDERAL RURAL DE PERNAMBUCO,UFRPE,Pública Federal,Universidade,Nordeste,Pernambuco
2050,15001,UNIVERSIDADE FEDERAL DA INTEGRAÇÃO LATINO-AMERICANA,UNILA,Pública Federal,Universidade,Sul,Paraná
2051,577,UNIVERSIDADE FEDERAL DE ALAGOAS,UFAL,Pública Federal,Universidade,Nordeste,Alagoas
2052,3430,"Faculdade Uberlandense de Núcleos Integrados de Ensino, Serviço Social e Aprendizagem",FAESSA,Privada sem fins lucrativos,Faculdade,Sudeste,Minas Gerais
2053,17014,CENTRO SUPERIOR DE ESTUDOS JURÍDICOS CARLOS DRUMMOND DE ANDRADE,CSEJCDA,Privada sem fins lucrativos,Faculdade,Sudeste,São Paulo
2054,17025,Faculdade de Educação Superior de Paragominas,FACESP,Privada com fins lucrativos,Faculdade,Norte,Pará
2055,17565,"FACULDADE DE CIÊNCIAS HUMANAS,EXATAS E DA SAÚDE DO PIAUÍ",FAHESP,Privada com fins lucrativos,Faculdade,Nordeste,Piauí
2056,2753,Faculdade de Ciências Educacionais de Capim Grosso,FCG,Privada com fins lucrativos,Faculdade,Nordeste,Bahia
2057,1027,UNIVERSIDADE ESTADUAL DO NORTE FLUMINENSE DARCY RIBEIRO,UENF,Pública Estadual,Universidade,Sudeste,Rio de Janeiro
2058,20322,Escola de Ensino Superior do Agreste Paraibano,EESAP,Privada com fins lucrativos,Faculdade,Nordeste,Paraíba
2059,17115,FACULDADE TRÊS MARIAS,FTM,Privada com fins lucrativos,Faculdade,Nordeste,Paraíba
2060,3189,"INSTITUTO FEDERAL DE EDUCAÇÃO, CIÊNCIA E TECNOLOGIA DE MINAS GERAIS",IFMG,Pública Federal,"Instituto Federal de Educação, Ciência e Tecnologia",Sudeste,Minas Gerais
2061,576,UNIVERSIDADE FEDERAL DE JUIZ DE FORA,UFJF,Pública Federal,Universidade,Sudeste,Minas Gerais
2062,17200,Faculdade Brasileira de Tributação,FBT,Privada com fins lucrativos,Faculdade,Sul,Rio Grande do Sul
2063,1059,FACULDADE LOURENÇO FILHO,FLF,Privada com fins lucrativos,Faculdade,Nordeste,Ceará
2064,13106,FACULDADE DE TECNOLOGIA LOURENÇO FILHO,FATEC FLF,Privada com fins lucrativos,Faculdade,Nordeste,Ceará
2065,17288,Faculdade Teológica Betânia,FATEBE,Privada sem fins lucrativos,Faculdade,Sul,Paraná
2066,600,"INSTITUTO FEDERAL DE EDUCAÇÃO, CIÊNCIA E TECNOLOGIA DO MARANHÃO",IFMA,Pública Federal,"Instituto Federal de Educação, Ciência e Tecnologia",Nordeste,Maranhão
2067,17326,FACULDADE GIANNA BERETTA,,Privada com fins lucrativos,Faculdade,Nordeste,Maranhão
2068,2624,FACULDADE DO LITORAL PARANAENSE,FLP,Privada com fins lucrativos,Faculdade,Sul,Paraná
