,CODIGO_IES,NOME_IES,SIGLA_IES,TIPO_CATEGORIA_ADM,TIPO_ORG_ACADEMICA,REGIAO,UF
1380,3008,FACULDADE DO INSTITUTO NACIONAL DE PÓS-GRADUAÇÃO DE SÃO JOSÉ DOS CAMPOS,FACULDADE INPG - SJC,Privada com fins lucrativos,Faculdade,Sudeste,São Paulo
1381,3012,FAJOPA - FACULDADE JOÃO PAULO II,FAJOPA,Privada sem fins lucrativos,Faculdade,Sudeste,São Paulo
1382,3020,FACULDADE SANTA RITA DE CÁSSIA,IFASC,Privada com fins lucrativos,Faculdade,Centro-Oeste,Goiás
1383,3029,FACULDADE DA AMAZÔNIA,FAAM,Privada com fins lucrativos,Faculdade,Norte,Pará
1384,3034,FACULDADE DELTA,FACDELTA,Privada com fins lucrativos,Faculdade,Nordeste,Bahia
1385,3039,FACULDADE VASCONCELLOS & SOUZA,,Privada sem fins lucrativos,Faculdade,Sudeste,Espírito Santo
1386,3042,CHRISTUS FACULDADE DO PIAUÍ,CHRISFAPI,Privada com fins lucrativos,Faculdade,Nordeste,Piauí
1387,3051,FACULDADE TEOLÓGICA DE CIÊNCIAS HUMANAS E SOCIAIS LOGOS,FAETEL,Privada sem fins lucrativos,Faculdade,Sudeste,São Paulo
1388,13832,FACULDADE SAGRADA FAMÍLIA,FASF,Privada sem fins lucrativos,Faculdade,Sul,Paraná
1389,3099,FACULDADE INTERNACIONAL DA PARAÍBA,FPB,Privada com fins lucrativos,Faculdade,Nordeste,Paraíba
1390,3146,FACULDADE DE ODONTOLOGIA DO RECIFE,FOR,Privada sem fins lucrativos,Faculdade,Nordeste,Pernambuco
1391,3148,FACULDADE ANCHIETA DO RECIFE,FAR,Privada com fins lucrativos,Faculdade,Nordeste,Pernambuco
1392,3151,UNIVERSIDADE COMUNITÁRIA DA REGIÃO DE CHAPECÓ,UNOCHAPECÓ,Privada sem fins lucrativos,Universidade,Sul,Santa Catarina
1393,146,CENTRO UNIVERSITÁRIO DE RIO PRETO,UNIRP,Privada com fins lucrativos,Centro Universitário,Sudeste,São Paulo
1394,3171,FACULDADE EQUIPE,,Privada sem fins lucrativos,Faculdade,Sul,Rio Grande do Sul
1395,3172,UNIVERSIDADE DO ESTADO DO AMAZONAS,UEA,Pública Estadual,Universidade,Norte,Amazonas
1396,3192,INSTITUTO SUPERIOR DE EDUCAÇÃO DE CAJAZEIRAS,ISEC,Privada com fins lucrativos,Faculdade,Nordeste,Paraíba
1397,3194,FACULDADE DE MINAS BH,FAMINAS-BH,Privada com fins lucrativos,Faculdade,Sudeste,Minas Gerais
1398,3204,FACULDADE DE QUATRO MARCOS,FQM,Privada com fins lucrativos,Faculdade,Centro-Oeste,Mato Grosso
1399,3205,FACULDADE DE CIÊNCIAS E TECNOLOGIA DE VIÇOSA,FAVIÇOSA,Privada com fins lucrativos,Faculdade,Sudeste,Minas Gerais
1400,3223,ESCOLA SUPERIOR DE CIÊNCIAS DA SAÚDE,ESCS,Pública Estadual,Faculdade,Centro-Oeste,Distrito Federal
1401,3268,FACULDADE MADRE THAIS,FMT,Privada com fins lucrativos,Faculdade,Nordeste,Bahia
1402,4597,FACULDADE FUTURA,,Privada sem fins lucrativos,Faculdade,Sudeste,São Paulo
1403,3285,FACULDADE SANTO ANTONIO,FSA,Privada com fins lucrativos,Faculdade,Nordeste,Bahia
1404,5133,FACULDADE SENAC SÃO MIGUEL DO OESTE,,Privada sem fins lucrativos,Faculdade,Sul,Santa Catarina
1405,5131,FACULDADE SENAC CAÇADOR,SENAC,Privada sem fins lucrativos,Faculdade,Sul,Santa Catarina
1406,4294,FACULDADE SENAC JARAGUÁ DO SUL,,Privada sem fins lucrativos,Faculdade,Sul,Santa Catarina
1407,3948,FACULDADE SENAC BLUMENAU,SENAC,Privada sem fins lucrativos,Faculdade,Sul,Santa Catarina
1408,3947,FACULDADE SENAC CHAPECÓ,SENAC,Privada sem fins lucrativos,Faculdade,Sul,Santa Catarina
1409,3946,FACULDADE SENAC TUBARÃO,,Privada sem fins lucrativos,Faculdade,Sul,Santa Catarina
1410,3295,FACULDADE SENAC FLORIANÓPOLIS,SENAC FLORIANÓPOLIS,Privada sem fins lucrativos,Faculdade,Sul,Santa Catarina
1411,18201,FACULDADE SENAC PALHOÇA,SENAC Palhoça,Privada sem fins lucrativos,Faculdade,Sul,Santa Catarina
1412,17777,FACULDADE SENAC CONCÓRDIA,,Privada sem fins lucrativos,Faculdade,Sul,Santa Catarina
1413,17277,Faculdade  SENAC Criciúma,Senac Criciúma,Privada sem fins lucrativos,Faculdade,Sul,Santa Catarina
1414,3332,FACULDADE DE TECNOLOGIA SENAC RIO,FATEC,Privada sem fins lucrativos,Faculdade,Sudeste,Rio de Janeiro
1415,3299,FACULDADE DE TECNOLOGIA INFORMÁTICA,FATI,Privada com fins lucrativos,Faculdade,Nordeste,Ceará
1416,3302,Faculdade REGES de Junqueirópolis,,Privada sem fins lucrativos,Faculdade,Sudeste,São Paulo
1417,3306,FACULDADE DE TECNOLOGIA IPUC,FATIPUC,Privada sem fins lucrativos,Faculdade,Sul,Rio Grande do Sul
1418,3308,FACULDADE DE TECNOLOGIA TERMOMECÂNICA,FTT,Privada sem fins lucrativos,Faculdade,Sudeste,São Paulo
1419,754,Centro Superior Una de Catalão,UNACAT,Privada com fins lucrativos,Faculdade,Centro-Oeste,Goiás
1420,3319,Instituto Universitário Una de Catalão,Catalana,Privada com fins lucrativos,Faculdade,Centro-Oeste,Goiás
1421,18474,FACULDADE UNA DE CATALÃO,UNA,Privada com fins lucrativos,Faculdade,Centro-Oeste,Goiás
1422,4496,FACULDADE DE TECNOLOGIA DO VALE DO IVAÍ,FATEC-IVAI,Privada com fins lucrativos,Faculdade,Sul,Paraná
1423,3323,INSTITUTO DE EDUCAÇÃO E ENSINO SUPERIOR DE CAMPINAS,IESCAMP,Privada com fins lucrativos,Faculdade,Sudeste,São Paulo
1424,12784,FACULDADE DE TECNOLOGIA FTEC,FTEC Novo Hamburgo,Privada com fins lucrativos,Faculdade,Sul,Rio Grande do Sul
1425,4097,FACULDADE DE TECNOLOGIA FTEC,FTEC Bento Gonçalves,Privada com fins lucrativos,Faculdade,Sul,Rio Grande do Sul
1426,3333,CENTRO UNIVERSITÁRIO UNIFTEC,,Privada com fins lucrativos,Centro Universitário,Sul,Rio Grande do Sul
1427,3337,FACULDADE DE TECNOLOGIA DE TERESINA,FACULDADE CET,Privada com fins lucrativos,Faculdade,Nordeste,Piauí
1428,3339,FACULDADE IDEAU DE GETÚLIO VARGAS,IDEAU,Privada com fins lucrativos,Faculdade,Sul,Rio Grande do Sul
1429,14288,FACULDADE CATÓLICA DE SANTA CATARINA,FACASC,Privada sem fins lucrativos,Faculdade,Sul,Santa Catarina
1430,3360,INSTITUTO DE EDUCAÇÃO SUPERIOR PRESIDENTE KENNEDY - CENTRO DE FORMAÇÃO DE PROFISSIONAIS DE EDUCAÇÃO,IFESP,Pública Estadual,Faculdade,Nordeste,Rio Grande do Norte
1431,14165,FACULDADE TRÊS PONTAS,FATEP,Privada sem fins lucrativos,Faculdade,Sudeste,Minas Gerais
1432,3955,FACULDADES INTEGRADAS DE CATAGUASES,FIC,Privada sem fins lucrativos,Faculdade,Sudeste,Minas Gerais
1433,3368,CENTRO UNIVERSITÁRIO DO SUL DE MINAS,UNIS-MG,Privada sem fins lucrativos,Centro Universitário,Sudeste,Minas Gerais
1434,20591,FACULDADE POUSO ALEGRE,FPA,Privada sem fins lucrativos,Faculdade,Sudeste,Minas Gerais
1435,2229,FACULDADE VICTOR HUGO,FVH,Privada com fins lucrativos,Faculdade,Sudeste,Minas Gerais
1436,3954,FACULDADE EDUCACIONAL JURÍDICA E GERENCIAL DE OLIVEIRA,FEJUGO,Privada sem fins lucrativos,Faculdade,Sudeste,Minas Gerais
1437,3371,CENTRO UNIVERSITÁRIO DE PATOS DE MINAS,UNIPAM,Privada sem fins lucrativos,Centro Universitário,Sudeste,Minas Gerais
1438,3372,CENTRO UNIVERSITÁRIO DE LAVRAS,UNILAVRAS,Privada sem fins lucrativos,Centro Universitário,Sudeste,Minas Gerais
1439,3375,INSTITUTO DE ENSINO SUPERIOR MÚLTIPLO,IESM,Privada com fins lucrativos,Faculdade,Nordeste,Maranhão
1440,3376,FACULDADE DE TEOLOGIA INTEGRADA,FATIN,Privada sem fins lucrativos,Faculdade,Nordeste,Pernambuco
1441,3388,FACULDADE PARAÍSO DO CEARÁ,FAP,Privada com fins lucrativos,Faculdade,Nordeste,Ceará
1442,3393,FACULDADE DE ENSINO SUPERIOR DOM BOSCO,FACDOMBOSCO,Privada com fins lucrativos,Faculdade,Sul,Paraná
1443,3396,FACULDADE LS,FACELS,Privada com fins lucrativos,Faculdade,Centro-Oeste,Distrito Federal
1444,3397,"FACULDADE BOAS NOVAS DE CIÊNCIAS TEOLÓGICAS, SOCIAIS E BIOTECNOLÓGICAS",FBNCTSB,Privada sem fins lucrativos,Faculdade,Norte,Amazonas
1445,4261,FACULDADE DE TECNOLOGIA DE PORTO ALEGRE,FATEPA,Privada com fins lucrativos,Faculdade,Sul,Rio Grande do Sul
1446,4077,Faculdade QI Brasil,FAQI,Privada com fins lucrativos,Faculdade,Sul,Rio Grande do Sul
1447,3428,FACULDADE ALFA AMÉRICA,,Privada com fins lucrativos,Faculdade,Sudeste,São Paulo
1448,3431,FACULDADE DO SERIDÓ,FAS,Privada com fins lucrativos,Faculdade,Nordeste,Rio Grande do Norte
1449,3434,FACULDADE DE SAÚDE E HUMANIDADES IBITURUNA,FASI,Privada com fins lucrativos,Faculdade,Sudeste,Minas Gerais
1450,3443,FACULDADE INEDI,CESUCA,Privada com fins lucrativos,Faculdade,Sul,Rio Grande do Sul
1451,4006,FACULDADE DE TECNOLOGIA SENAC PELOTAS,FATEC SENAC PELOTAS,Privada sem fins lucrativos,Faculdade,Sul,Rio Grande do Sul
1452,3804,FACULDADE SENAC PORTO ALEGRE - FSPOA,SENAC/RS,Privada sem fins lucrativos,Faculdade,Sul,Rio Grande do Sul
1453,3495,FACULDADE PINHALZINHO,HORUS,Privada com fins lucrativos,Faculdade,Sul,Santa Catarina
1454,18257,FACULDADE HORUS SÄO MIGUEL,FSJ,Privada com fins lucrativos,Faculdade,Sul,Santa Catarina
1455,11951,FACULDADE DO SERTÃO BAIANO,FASBE,Privada com fins lucrativos,Faculdade,Nordeste,Bahia
1456,3506,FACULDADE DE CIÊNCIAS EDUCACIONAIS DE SERGIPE,FCES,Privada com fins lucrativos,Faculdade,Nordeste,Sergipe
1457,3509,FACULDADE VICENTINA - FAVI,FAVI,Privada sem fins lucrativos,Faculdade,Sul,Paraná
1458,3518,Faculdade SOCIESC de Jaraguá do Sul,SOCIESC,Privada com fins lucrativos,Faculdade,Sul,Santa Catarina
1459,3363,FACULDADE GUARAÍ,FAG,Privada com fins lucrativos,Faculdade,Norte,Tocantins
1460,3522,FACULDADE CATÓLICA DE POUSO ALEGRE,FACAPA,Privada sem fins lucrativos,Faculdade,Sudeste,Minas Gerais
1461,3523,FACULDADE DE DIREITO DA FUNDAÇÃO ESCOLA SUPERIOR DO MINISTÉRIO PÚBLICO,,Privada sem fins lucrativos,Faculdade,Sul,Rio Grande do Sul
1462,3525,"FACULDADE EVANGÉLICA DE TECNOLOGIA, CIÊNCIAS E BIOTECNOLOGIA DA CGADB",FAECAD,Privada sem fins lucrativos,Faculdade,Sudeste,Rio de Janeiro
1463,60,CENTRO UNIVERSITÁRIO MUNICIPAL DE FRANCA,UNI-FACEF,Especial,Centro Universitário,Sudeste,São Paulo
1464,3530,FACULDADE DE NANUQUE,FANAN,Privada com fins lucrativos,Faculdade,Sudeste,Minas Gerais
1465,3782,FACULDADE DE TECNOLOGIA CACHOEIRO DE ITAPEMIRIM,FACI,Privada com fins lucrativos,Faculdade,Sudeste,Espírito Santo
1466,3536,FACULDADE DE TEOLOGIA EVANGÉLICA EM CURITIBA - FATEV,FATEV,Privada sem fins lucrativos,Faculdade,Sul,Paraná
1467,3542,INSTITUTO DE ENSINO SUPERIOR DE MINAS GERAIS,IESMIG,Privada com fins lucrativos,Faculdade,Sudeste,Minas Gerais
1468,3543,FACULDADE NOVO HAMBURGO,FACULDADE IENH,Privada sem fins lucrativos,Faculdade,Sul,Rio Grande do Sul
1469,3573,FACULDADE TEOLÓGICA BATISTA DE BRASÍLIA,FTBB,Privada sem fins lucrativos,Faculdade,Centro-Oeste,Distrito Federal
1470,3585,FACULDADE SANTA CRUZ,FACRUZ,Privada com fins lucrativos,Faculdade,Nordeste,Pernambuco
1471,3584,INSTITUTO SUPERIOR DE EDUCAÇÃO SANTA CRUZ,ISED,Privada com fins lucrativos,Faculdade,Nordeste,Pernambuco
1472,3587,FACULDADE DIOCESANA SÃO JOSÉ,FADISI,Privada sem fins lucrativos,Faculdade,Norte,Acre
1473,1858,Faculdade Dom Pedro II de Jequié,DP II,Privada com fins lucrativos,Faculdade,Nordeste,Bahia
1474,4460,FACULDADE DOM PEDRO II DE TECNOLOGIA,FAB,Privada com fins lucrativos,Faculdade,Nordeste,Bahia
1475,3588,CENTRO UNIVERSITÁRIO DOM PEDRO II,UNIDOMPEDRO,Privada com fins lucrativos,Centro Universitário,Nordeste,Bahia
1476,3427,Faculdade Dom Pedro II de Sergipe,DP II Sergipe,Privada sem fins lucrativos,Faculdade,Nordeste,Sergipe
1477,3270,FACULDADE SÃO BENTO DA BAHIA,FSBB,Privada sem fins lucrativos,Faculdade,Nordeste,Bahia
1478,2553,Faculdade Dom Pedro II - Luis Eduardo Magalhães,FDP II LEM,Privada com fins lucrativos,Faculdade,Nordeste,Bahia
1479,1124,Faculdade Dom Pedro II de Barreiras,DP II Barreiras,Privada com fins lucrativos,Faculdade,Nordeste,Bahia
1480,3590,FACULDADE DE ENFERMAGEM SÃO VICENTE DE PAULA,FESVIP,Privada com fins lucrativos,Faculdade,Nordeste,Paraíba
1481,3607,ESCOLA SUPERIOR ASSOCIADA DE GOIÂNIA,ESUP,Privada com fins lucrativos,Faculdade,Centro-Oeste,Goiás
1482,3615,FACULDADE PERNAMBUCANA DE SAÚDE,FPS,Privada sem fins lucrativos,Faculdade,Nordeste,Pernambuco
1483,3617,FACULDADE DE CIÊNCIAS HUMANAS E EXATAS DO SERTÃO DO SÃO FRANCISCO,FACESF,Privada com fins lucrativos,Faculdade,Nordeste,Pernambuco
1484,3618,FACULDADE LUSÓFONA DE SÃO PAULO,FL-SP,Privada com fins lucrativos,Faculdade,Sudeste,São Paulo
1485,3625,Faculdade do Complexo Educacional Santo André,FACESA,Privada com fins lucrativos,Faculdade,Nordeste,Rio Grande do Norte
1486,3631,FACULDADE DAMAS DA INSTRUÇÃO CRISTÃ,FADIC,Privada sem fins lucrativos,Faculdade,Nordeste,Pernambuco
1487,3644,FACULDADE CATÓLICA SANTA TERESINHA,FCST,Privada com fins lucrativos,Faculdade,Nordeste,Rio Grande do Norte
1488,3649,CENTRO UNIVERSITÁRIO CIDADE VERDE,UNIFCV,Privada com fins lucrativos,Centro Universitário,Sul,Paraná
1489,3663,FACULDADE FORTIUM DE BRASÍLIA,FFB,Privada com fins lucrativos,Faculdade,Centro-Oeste,Distrito Federal
1490,3682,INSTITUTO SUPERIOR DE EDUCAÇÃO DO MUNICÍPIO DE ITAPERUNA,ISEMI,Pública Municipal,Faculdade,Sudeste,Rio de Janeiro
1491,3690,FACULDADE PEDRO II,FAPE2,Privada com fins lucrativos,Faculdade,Sudeste,Minas Gerais
1492,11289,ESCOLA SUPERIOR NACIONAL DE SEGUROS DE SÃO PAULO,ESNS-SP,Privada sem fins lucrativos,Faculdade,Sudeste,São Paulo
1493,3710,ESCOLA SUPERIOR NACIONAL DE SEGUROS,ESNS,Privada sem fins lucrativos,Faculdade,Sudeste,Rio de Janeiro
1494,3716,FACULDADE CIÊNCIAS DA VIDA,FCV,Privada com fins lucrativos,Faculdade,Sudeste,Minas Gerais
1495,3724,FACULDADE MARANHENSE SÃO JOSÉ DOS COCAIS,FSJ,Privada com fins lucrativos,Faculdade,Nordeste,Maranhão
1496,3741,Faculdade Pitágoras Bacabal Mearim,,Privada com fins lucrativos,Faculdade,Nordeste,Maranhão
1497,14156,Faculdade Presidente Antônio Carlos de Teófilo Otoni,,Privada com fins lucrativos,Faculdade,Sudeste,Minas Gerais
1498,14029,Faculdade Presidente Antônio Carlos de Aimorés,,Privada com fins lucrativos,Faculdade,Sudeste,Minas Gerais
1499,3756,ALFA - Faculdade de Almenara,,Privada com fins lucrativos,Faculdade,Sudeste,Minas Gerais
1500,18692,ALFA - Faculdade de Guanhães,ALFA - Gunhães,Privada com fins lucrativos,Faculdade,Sudeste,Minas Gerais
1501,18520,ALFA - Faculdade de Araçuai,ALFA-Araçuai,Privada com fins lucrativos,Faculdade,Sudeste,Minas Gerais
1502,3757,FACULDADE SERRA DA MESA,FASEM,Privada com fins lucrativos,Faculdade,Centro-Oeste,Goiás
1503,3768,Faculdade IBGEN,,Privada com fins lucrativos,Faculdade,Sul,Rio Grande do Sul
1504,3769,FACULDADE MADRE TEREZA,FAMAT,Privada com fins lucrativos,Faculdade,Norte,Amapá
1505,3770,FACULDADE TEOLÓGICA BATISTA DE SÃO PAULO,FTBSP,Privada sem fins lucrativos,Faculdade,Sudeste,São Paulo
1506,3774,FACULDADE SÃO TOMAZ DE AQUINO,FSTA,Privada com fins lucrativos,Faculdade,Nordeste,Bahia
1507,3775,INSTITUTO UVB.BR,IUVB,Privada com fins lucrativos,Faculdade,Sudeste,São Paulo
1508,3790,FACULDADE DE TECNOLOGIA ENSITEC,ENSITEC,Privada com fins lucrativos,Faculdade,Sul,Paraná
1509,3797,FACULDADE GUAIRACÁ,FAG,Privada com fins lucrativos,Faculdade,Sul,Paraná
1510,21992,Faculdade Guairacá de Prudentópolis,FGP,Privada com fins lucrativos,Faculdade,Sul,Paraná
1511,4000,FACULDADE DE ENSINO SUPERIOR DO INTERIOR PAULISTA,FAIP,Privada com fins lucrativos,Faculdade,Sudeste,São Paulo
1512,3815,FACULDADE DE DIREITO DE ALTA FLORESTA,,Privada sem fins lucrativos,Faculdade,Centro-Oeste,Mato Grosso
1513,3817,FACULDADE UNINASSAU JOÃO PESSOA,,Privada sem fins lucrativos,Faculdade,Nordeste,Paraíba
1514,19329,FACULDADE UNINABUCO JOÃO PESSOA,,Privada sem fins lucrativos,Faculdade,Nordeste,Paraíba
1515,4992,FACULDADE DE TECNOLOGIA CENTEC - SERTÃO CENTRAL,FTC SERTÃO CENTRAL,Privada sem fins lucrativos,Faculdade,Nordeste,Ceará
1516,4791,FACULDADE DE TECNOLOGIA CENTEC - CARIRI,CENTEC,Privada sem fins lucrativos,Faculdade,Nordeste,Ceará
1517,1066,INSTITUTO DE ENSINO E PESQUISA OBJETIVO,IEPO,Privada com fins lucrativos,Faculdade,Norte,Tocantins
1518,2085,CENTRO UNIVERSITÁRIO DE SALVADOR,UNICEUSA,Privada com fins lucrativos,Centro Universitário,Nordeste,Bahia
1519,3788,FACULDADE JUIZ DE FORA,FJF,Privada com fins lucrativos,Faculdade,Sudeste,Minas Gerais
1520,3786,FACULDADE DE ENSINO DE MINAS GERAIS,FACEMG,Privada com fins lucrativos,Faculdade,Sudeste,Minas Gerais
1521,3785,INSTITUTO MARANHENSE DE ENSINO E CULTURA,IMEC,Privada com fins lucrativos,Faculdade,Nordeste,Maranhão
1522,3777,FACULDADE CURITIBANA,FAC,Privada com fins lucrativos,Faculdade,Sul,Paraná
1523,3776,INSTITUTO DE ENSINO SUPERIOR DE MATO GROSSO,IESMT,Privada com fins lucrativos,Faculdade,Centro-Oeste,Mato Grosso
1524,2909,FACULDADE DO ESTADO DO MARANHÃO,FACEM,Privada com fins lucrativos,Faculdade,Nordeste,Maranhão
1525,1996,INSTITUTO CUIABÁ DE ENSINO E CULTURA,ICEC,Privada com fins lucrativos,Faculdade,Centro-Oeste,Mato Grosso
1526,322,UNIVERSIDADE PAULISTA,UNIP,Privada com fins lucrativos,Universidade,Sudeste,São Paulo
1527,2470,INSTITUTO SALVADOR DE ENSINO E CULTURA,ISEC,Privada com fins lucrativos,Faculdade,Nordeste,Bahia
1528,2420,FACULDADE PARANAENSE,FAPAR,Privada com fins lucrativos,Faculdade,Sul,Paraná
1529,2241,CENTRO UNIVERSITÁRIO DO SUDESTE MINEIRO,,Privada com fins lucrativos,Centro Universitário,Sudeste,Minas Gerais
1530,2171,INSTITUTO BELO HORIZONTE DE ENSINO SUPERIOR,IBHES,Privada com fins lucrativos,Faculdade,Sudeste,Minas Gerais
1531,2148,FACULDADE DE PALMAS,FAPAL,Privada com fins lucrativos,Faculdade,Norte,Tocantins
1532,3840,CENTRO UNIVERSITÁRIO FACVEST,UNIFACVEST,Privada com fins lucrativos,Centro Universitário,Sul,Santa Catarina
1533,3853,FACULDADE UNINASSAU NATAL,,Privada com fins lucrativos,Faculdade,Nordeste,Rio Grande do Norte
1534,3854,FACULDADE IDEAL DE BRASÍLIA,IDEAL,Privada com fins lucrativos,Faculdade,Centro-Oeste,Distrito Federal
1535,3862,FACULDADE LUCIANO FEIJÃO,FLF,Privada sem fins lucrativos,Faculdade,Nordeste,Ceará
1536,3866,FACULDADE BRASILEIRA DE EDUCAÇÃO E CULTURA,FABEC BRASIL,Privada com fins lucrativos,Faculdade,Centro-Oeste,Goiás
1537,3867,FACULDADE MAUÁ DE BRASÍLIA,MAUADF,Privada com fins lucrativos,Faculdade,Centro-Oeste,Distrito Federal
1538,3869,INSTITUTO FLORENCE DE ENSINO SUPERIOR,IFES,Privada com fins lucrativos,Faculdade,Nordeste,Maranhão
1539,3877,Faculdade Linear,LINEAR,Privada com fins lucrativos,Faculdade,Centro-Oeste,Goiás
1540,757,Centro Universitário da Amazônia,Unama,Privada com fins lucrativos,Centro Universitário,Norte,Pará
1541,3879,Centro Universitário Maurício de Nassau de Campina Grande,UNINASSAU CPV,Privada com fins lucrativos,Centro Universitário,Nordeste,Paraíba
1542,383,UNIVERSIDADE DA AMAZÔNIA,UNAMA,Privada com fins lucrativos,Universidade,Norte,Pará
1543,610,CENTRO UNIVERSITÁRIO UNIVERSUS VERITAS,UNIVERITAS,Privada com fins lucrativos,Centro Universitário,Sudeste,Rio de Janeiro
1544,18647,FACULDADE DA AMAZÔNIA DE MARABÁ,,Privada com fins lucrativos,Faculdade,Norte,Pará
1545,3881,FACULDADE DE INTEGRAÇÃO DO SERTÃO,FIS,Privada com fins lucrativos,Faculdade,Nordeste,Pernambuco
1546,922,FACULDADE REGES DE DRACENA,FCGD,Privada sem fins lucrativos,Faculdade,Sudeste,São Paulo
1547,4596,FACULDADE REGES DE RIBEIRÃO PRETO,,Privada sem fins lucrativos,Faculdade,Sudeste,São Paulo
1548,797,Faculdade AVEC de Vilhena,AVEC,Privada sem fins lucrativos,Faculdade,Norte,Rondônia
1549,1122,FACULDADE REGES DE OSVALDO CRUZ,,Privada sem fins lucrativos,Faculdade,Sudeste,São Paulo
1550,3896,Faculdade Paulista de Comunicação,FEPAC,Privada sem fins lucrativos,Faculdade,Sudeste,São Paulo
1551,4101,FACULDADE DE TECNOLOGIA SENAI DE DESENVOLVIMENTO GERENCIAL,FATESG,Privada sem fins lucrativos,Faculdade,Centro-Oeste,Goiás
1552,4100,FACULDADE DE TECNOLOGIA SENAI ÍTALO BOLOGNA,FATECIB,Privada sem fins lucrativos,Faculdade,Centro-Oeste,Goiás
1553,3920,FACULDADE DE TECNOLOGIA SENAI ROBERTO MANGE,FATEC SENAI RM,Privada sem fins lucrativos,Faculdade,Centro-Oeste,Goiás
1554,3921,CENTRO UNIVERSITÁRIO ARNALDO HORÁCIO FERREIRA,,Privada com fins lucrativos,Centro Universitário,Nordeste,Bahia
1555,3930,INSTITUTO DE EDUCAÇÃO SUPERIOR RAIMUNDO SÁ,IESRSA,Privada com fins lucrativos,Faculdade,Nordeste,Piauí
1556,3933,FACULDADE MÉTODO DE SÃO PAULO,FAMESP,Privada com fins lucrativos,Faculdade,Sudeste,São Paulo
1557,3940,FACULDADE DE ENSINO SUPERIOR SANTA BARBARA,FAESB,Privada sem fins lucrativos,Faculdade,Sudeste,São Paulo
1558,548,UNIVERSIDADE FEDERAL DO MARANHÃO,UFMA,Pública Federal,Universidade,Nordeste,Maranhão
1559,3962,CENTRO UNIVERSITÁRIO SENAI CIMATEC,SENAI CIMATEC,Privada sem fins lucrativos,Centro Universitário,Nordeste,Bahia
1560,4017,CENTRO UNIVERSITÁRIO PADRE ANCHIETA,UNIANCHIETA,Privada com fins lucrativos,Centro Universitário,Sudeste,São Paulo
1561,3977,FACULDADE DE TECNOLOGIA DO AMAPÁ,META,Privada com fins lucrativos,Faculdade,Norte,Amapá
1562,3978,FACULDADE DE TECNOLOGIA PENTÁGONO,FATEP,Privada com fins lucrativos,Faculdade,Sudeste,São Paulo
1563,3980,FACULDADE JK BRASÍLIA -SAMAMBAIA,,Privada com fins lucrativos,Faculdade,Centro-Oeste,Distrito Federal
1564,3986,FACULDADE INSTITUTO SUPERIOR DE EDUCAÇÃO DO PARANÁ - FAINSEP,FAINSEP,Privada sem fins lucrativos,Faculdade,Sul,Paraná
1565,3987,FACULDADE UNIÃO DE GOYAZES,FUG,Privada com fins lucrativos,Faculdade,Centro-Oeste,Goiás
1566,3996,FACULDADE SENAC PERNAMBUCO,SENACPE,Privada sem fins lucrativos,Faculdade,Nordeste,Pernambuco
1567,3998,INSTITUTO INFNET RIO DE JANEIRO,INFNET,Privada com fins lucrativos,Faculdade,Sudeste,Rio de Janeiro
1568,4007,"FATECE - FACULDADE DE TECNOLOGIA, CIÊNCIAS E EDUCAÇÃO",FATECE,Privada com fins lucrativos,Faculdade,Sudeste,São Paulo
1569,4037,CENTRO UNIVERSITÁRIO PITÁGORAS DE FORTALEZA,UNIPITÁGORAS,Privada com fins lucrativos,Centro Universitário,Nordeste,Ceará
1570,12754,FACULDADE CRISTÃ DE CURITIBA,FCC,Privada sem fins lucrativos,Faculdade,Sul,Paraná
1571,4059,FACULDADE DE CIÊNCIAS GERENCIAIS,,Privada com fins lucrativos,Faculdade,Sudeste,São Paulo
1572,1161,INSPER INSTITUTO DE ENSINO E PESQUISA,INSPER,Privada sem fins lucrativos,Faculdade,Sudeste,São Paulo
1573,823,UNIVERSIDADE CEUMA,UNICEUMA,Privada sem fins lucrativos,Universidade,Nordeste,Maranhão
1574,4079,FACULDADE TECNOLÓGICA INAP,FAT- INAP,Privada com fins lucrativos,Faculdade,Sudeste,Minas Gerais
1575,4086,FACULDADE DE TECNOLOGIA JARDIM,FATEJ,Privada com fins lucrativos,Faculdade,Sudeste,São Paulo
1576,4093,FACULDADE DE TECNOLOGIA DE CURITIBA,FATEC-PR,Privada com fins lucrativos,Faculdade,Sul,Paraná
1577,4104,ESCOLA SUPERIOR DE ENGENHARIA E GESTÃO DE SÃO PAULO - ESEG,ESEG,Privada com fins lucrativos,Faculdade,Sudeste,São Paulo
1578,4107,FACULDADE DE TECNOLOGIA SENAI PORTO ALEGRE,FATEC SENAI,Privada sem fins lucrativos,Faculdade,Sul,Rio Grande do Sul
1579,4108,INSTITUTO CATÓLICO DE ESTUDOS SUPERIORES DO PIAUÍ,ICESPI,Privada com fins lucrativos,Faculdade,Nordeste,Piauí
1580,4121,FACULDADE UNINASSAU ARACAJU,,Privada sem fins lucrativos,Faculdade,Nordeste,Sergipe
1581,17284,FACULDADE UNINASSAU SÃO LUÍS,,Privada sem fins lucrativos,Faculdade,Nordeste,Maranhão
1582,2548,"FACULDADE DE TEOLOGIA, FILOSOFIA E CIÊNCIAS HUMANAS GAMALIEL",FATEFIG,Privada com fins lucrativos,Faculdade,Norte,Pará
1583,4150,FACULDADE DE TECNOLOGIA DE PIRACICABA,FATEP,Privada com fins lucrativos,Faculdade,Sudeste,São Paulo
1584,4162,Faculdade SENAC Goiás,FacSenacGO,Privada sem fins lucrativos,Faculdade,Centro-Oeste,Goiás
1585,4169,Faculdade Estácio de Carapicuíba,ESTÁCIO CARAPICUÍBA,Privada com fins lucrativos,Faculdade,Sudeste,São Paulo
1586,4534,FACULDADE HERRERO,FATEC,Privada com fins lucrativos,Faculdade,Sul,Paraná
1587,4197,Faculdade Uninassau Aliança - Redenção,Nassau Aliança,Privada com fins lucrativos,Faculdade,Nordeste,Piauí
1588,4198,Faculdade Morgana Potrich,FAMP,Privada com fins lucrativos,Faculdade,Centro-Oeste,Goiás
1589,4257,INSTITUTO DE FILOSOFIA E TEOLOGIA DE GOIÁS,IFITEG,Privada sem fins lucrativos,Faculdade,Centro-Oeste,Goiás
1590,507,Faculdade Mais de Ituiutaba,FacMais,Privada sem fins lucrativos,Faculdade,Sudeste,Minas Gerais
1591,4259,FACULDADE DE INHUMAS - FAC-MAIS,FACMAIS,Privada com fins lucrativos,Faculdade,Centro-Oeste,Goiás
1592,4277,FACULDADE ESTÁCIO DO AMAZONAS - ESTÁCIO AMAZONAS,ESTÁCIO AMAZONAS,Privada com fins lucrativos,Faculdade,Norte,Amazonas
1593,14718,FACULDADE PARANÁ,FAP,Privada com fins lucrativos,Faculdade,Sul,Paraná
1594,1520,FACULDADE FIA DE ADMINISTRAÇÃO E NEGÓCIOS,FFIA,Privada sem fins lucrativos,Faculdade,Sudeste,São Paulo
1595,4329,FACULDADE DO CENTRO EDUCACIONAL MINEIRO - FACEM,FACEM-BH,Privada com fins lucrativos,Faculdade,Sudeste,Minas Gerais
1596,4355,FACULDADE DE TECNOLOGIA DE PALMAS,FTP,Privada com fins lucrativos,Faculdade,Norte,Tocantins
1597,1853,Centro Universitário UNIBTA,,Privada com fins lucrativos,Centro Universitário,Sudeste,São Paulo
1598,10071,FACULDADE DE TEOLOGIA E CIÊNCIAS HUMANAS,ITEPAFACULDADES,Privada sem fins lucrativos,Faculdade,Sul,Rio Grande do Sul
1599,13812,ESCOLA SUPERIOR ABERTA DO BRASIL,ESAB,Privada com fins lucrativos,Faculdade,Sudeste,Espírito Santo
1600,4399,FACULDADE DE BALSAS,UNIBALSAS,Privada com fins lucrativos,Faculdade,Nordeste,Maranhão
1601,4411,FACULDADE PANAMERICANA DE JI-PARANÁ,,Privada sem fins lucrativos,Faculdade,Norte,Rondônia
1602,4531,FACULDADE ADVENTISTA DA BAHIA,FADBA,Privada sem fins lucrativos,Faculdade,Nordeste,Bahia
1603,4428,FACULDADE PROFESSOR MIGUEL ÂNGELO DA SILVA SANTOS,FEMASS,Pública Municipal,Faculdade,Sudeste,Rio de Janeiro
1604,4443,FACULDADE AMÉRICA LATINA  DE IJUÍ,FAL,Privada com fins lucrativos,Faculdade,Sul,Rio Grande do Sul
1605,4452,CENTRO UNIVERSITÁRIO PITÁGORAS DE MARABÁ,,Privada com fins lucrativos,Centro Universitário,Norte,Pará
1606,4492,FACULDADE PASCHOAL DANTAS,FPD,Privada sem fins lucrativos,Faculdade,Sudeste,São Paulo
1607,4518,FACULDADE REGIONAL PALMITOS,FAP,Privada com fins lucrativos,Faculdade,Sul,Santa Catarina
1608,4566,ESTÁCIO FATERN - FACULDADE ESTÁCIO DO RIO GRANDE DO NORTE,ESTÁCIO FATERN,Privada com fins lucrativos,Faculdade,Nordeste,Rio Grande do Norte
1609,4532,FACULDADE DE TECNOLOGIA SENAI CAMPO GRANDE,,Privada sem fins lucrativos,Faculdade,Centro-Oeste,Mato Grosso do Sul
1610,19324,Faculdade de Tecnologia SENAI Dourados,FATEC Dourados,Privada sem fins lucrativos,Faculdade,Centro-Oeste,Mato Grosso do Sul
1611,16559,FACULDADE SÃO FRANCISCO DO CEARÁ,FASC,Privada com fins lucrativos,Faculdade,Nordeste,Ceará
1612,4533,FACULDADE SÃO FRANCISCO DA PARAÍBA,FASP,Privada com fins lucrativos,Faculdade,Nordeste,Paraíba
1613,10588,FACULDADE UNINABUCO SÃO LOURENÇO DA MATA,,Privada sem fins lucrativos,Faculdade,Nordeste,Pernambuco
