,CODIGO_IES,NOME_IES,SIGLA_IES,TIPO_CATEGORIA_ADM,TIPO_ORG_ACADEMICA,REGIAO,UF
0,1,UNIVERSIDADE FEDERAL DE MATO GROSSO,UFMT,Pública Federal,Universidade,Centro-Oeste,Mato Grosso
1,2,UNIVERSIDADE DE BRASÍLIA,UNB,Pública Federal,Universidade,Centro-Oeste,Distrito Federal
2,3,UNIVERSIDADE FEDERAL DE SERGIPE,UFS,Pública Federal,Universidade,Nordeste,Sergipe
3,4,UNIVERSIDADE FEDERAL DO AMAZONAS,UFAM,Pública Federal,Universidade,Norte,Amazonas
4,6,UNIVERSIDADE FEDERAL DE OURO PRETO,UFOP,Pública Federal,Universidade,Sudeste,Minas Gerais
5,10,PONTIFÍCIA UNIVERSIDADE CATÓLICA DO PARANÁ,PUCPR,Privada sem fins lucrativos,Universidade,Sul,Paraná
6,11,UNIVERSIDADE CATÓLICA DE PERNAMBUCO,UNICAP,Privada sem fins lucrativos,Universidade,Nordeste,Pernambuco
7,13,UNIVERSIDADE DE CAXIAS DO SUL,UCS,Privada sem fins lucrativos,Universidade,Sul,Rio Grande do Sul
8,14,UNIVERSIDADE DO VALE DO RIO DOS SINOS,UNISINOS,Privada sem fins lucrativos,Universidade,Sul,Rio Grande do Sul
9,18,UNIVERSIDADE CATÓLICA DE PELOTAS,UCPEL,Privada sem fins lucrativos,Universidade,Sul,Rio Grande do Sul
10,19,PONTIFÍCIA UNIVERSIDADE CATÓLICA DE CAMPINAS,PUC-CAMPINAS,Privada sem fins lucrativos,Universidade,Sudeste,São Paulo
11,20,UNIVERSIDADE DE PASSO FUNDO,UPF,Privada sem fins lucrativos,Universidade,Sul,Rio Grande do Sul
12,21,PONTIFÍCIA UNIVERSIDADE CATÓLICA DO RIO GRANDE DO SUL,PUCRS,Privada sem fins lucrativos,Universidade,Sul,Rio Grande do Sul
13,19229,FACULDADE PRESBITERIANA MACKENZIE BRASILIA,FPMB,Privada sem fins lucrativos,Faculdade,Centro-Oeste,Distrito Federal
14,353,FACULDADE EVANGÉLICA MACKENZIE DO PARANÁ,FEMPAR,Privada sem fins lucrativos,Faculdade,Sul,Paraná
15,22,UNIVERSIDADE PRESBITERIANA MACKENZIE,MACKENZIE,Privada sem fins lucrativos,Universidade,Sudeste,São Paulo
16,195,FACULDADE PRESBITERIANA MACKENZIE RIO,,Privada sem fins lucrativos,Faculdade,Sudeste,Rio de Janeiro
17,23,UNIVERSIDADE FEEVALE,FEEVALE,Privada sem fins lucrativos,Universidade,Sul,Rio Grande do Sul
18,24,UNIVERSIDADE ESTADUAL DE SANTA CRUZ,UESC,Pública Estadual,Universidade,Nordeste,Bahia
19,26,ESCOLA NACIONAL DE CIÊNCIAS ESTATÍSTICAS,ENCE,Pública Federal,Faculdade,Sudeste,Rio de Janeiro
20,27,UNIVERSIDADE VALE DO RIO VERDE,UNINCOR,Privada sem fins lucrativos,Universidade,Sudeste,Minas Gerais
21,29,UNIVERSIDADE ESTADUAL DO CEARÁ,UECE,Pública Estadual,Universidade,Nordeste,Ceará
22,30,UNIVERSIDADE JOSÉ DO ROSÁRIO VELLANO,UNIFENAS,Privada sem fins lucrativos,Universidade,Sudeste,Minas Gerais
23,32,UNIVERSIDADE ESTADUAL DE CIÊNCIAS DA SAÚDE DE ALAGOAS - UNCISAL,UNCISAL,Pública Estadual,Universidade,Nordeste,Alagoas
24,18817,Faculdade de Tecnologia de São Roque,FATEC-SR,Pública Estadual,Faculdade,Sudeste,São Paulo
25,4024,FACULDADE DE TECNOLOGIA DE MOCOCA,FATEC,Pública Estadual,Faculdade,Sudeste,São Paulo
26,18049,Faculdade de Tecnologia de Taubaté,FATEC TAUBATÉ,Pública Estadual,Faculdade,Sudeste,São Paulo
27,19501,Faculdade de Tecnologia Sebrae,FATEC SEBRAE,Pública Estadual,Faculdade,Sudeste,São Paulo
28,19864,Faculdade de Tecnologia de Itapira,FATEC Itapira,Pública Estadual,Faculdade,Sudeste,São Paulo
29,24672,FACULDADE DE TECNOLOGIA DE MATÃO,,Pública Estadual,Faculdade,Sudeste,São Paulo
30,23438,Faculdade de Tecnologia de Araras,,Pública Estadual,Faculdade,Sudeste,São Paulo
31,967,FACULDADE DE TECNOLOGIA DE TAQUARITINGA,FATEC/TQ,Pública Estadual,Faculdade,Sudeste,São Paulo
32,15581,Faculdade de Tecnologia de São José dos Campos - Jessen Vidal,FATECSJCAMPOS,Pública Estadual,Faculdade,Sudeste,São Paulo
33,15695,Faculdade de Tecnologia Dom Amaury Castanho,Fatec Itu,Pública Estadual,Faculdade,Sudeste,São Paulo
34,37,FACULDADE DE TECNOLOGIA DE JAHU,FATEC-JAHU,Pública Estadual,Faculdade,Sudeste,São Paulo
35,15585,Faculdade de Tecnologia Santo André,FATEC-SA,Pública Estadual,Faculdade,Sudeste,São Paulo
36,19578,Faculdade de Tecnologia de Cotia,FATEC COTIA,Pública Estadual,Faculdade,Sudeste,São Paulo
37,15714,Fatec Arthur Azevedo - Mogi Mirim,FATECMM,Pública Estadual,Faculdade,Sudeste,São Paulo
38,4023,FACULDADE DE TECNOLOGIA DE MAUÁ,FATEC MAUÁ,Pública Estadual,Faculdade,Sudeste,São Paulo
39,5627,FACULDADE DE TECNOLOGIA DE PRESIDENTE PRUDENTE,FATEC,Pública Estadual,Faculdade,Sudeste,São Paulo
40,15715,FACULDADE DE TECNOLOGIA PROFESSOR ANTÔNIO SEABRA,FATEC LINS,Pública Estadual,Faculdade,Sudeste,São Paulo
41,15682,Faculdade de Tecnologia de Piracicaba,Fatec Piracicaba,Pública Estadual,Faculdade,Sudeste,São Paulo
42,15746,Faculdade de Tecnologia do Ipiranga,FATECIPI,Pública Estadual,Faculdade,Sudeste,São Paulo
43,15696,Faculdade de Tecnologia de Sertãozinho,FATEC SERTÃOZINHO,Pública Estadual,Faculdade,Sudeste,São Paulo
44,33,FACULDADE DE TECNOLOGIA DE SOROCABA,FATEC SO,Pública Estadual,Faculdade,Sudeste,São Paulo
45,15709,Faculdade de Tecnologia de Osasco - Prefeito Hirant Sanazar,Fatec Osasco,Pública Estadual,Faculdade,Sudeste,São Paulo
46,15753,FACULDADE DE TECNOLOGIA NILO DE STÉFANI - JABOTICABAL,FATEC JBL,Pública Estadual,Faculdade,Sudeste,São Paulo
47,23459,Faculdade de Tecnologia de Adamantina,,Pública Estadual,Faculdade,Sudeste,São Paulo
48,15803,FACULDADE DE TECNOLOGIA DE TATUÍ - PROF. WILSON ROBERTO RIBEIRO DE CAMARGO,FATEC TATUÍ,Pública Estadual,Faculdade,Sudeste,São Paulo
49,15757,Faculdade de Tecnologia de Barueri,Fatec Barueri,Pública Estadual,Faculdade,Sudeste,São Paulo
50,4025,FACULDADE DE TECNOLOGIA DE SÃO JOSÉ DO RIO PRETO,FATECRP,Pública Estadual,Faculdade,Sudeste,São Paulo
51,15639,Faculdade de Tecnologia de Itaquaquecetuba,Fatec Itaqua,Pública Estadual,Faculdade,Sudeste,São Paulo
52,4021,FACULDADE DE TECNOLOGIA DE GARÇA,FATECGA,Pública Estadual,Faculdade,Sudeste,São Paulo
53,17942,Faculdade de Tecnologia do Tatuapé,FATEC-TT,Pública Estadual,Faculdade,Sudeste,São Paulo
54,19739,Faculdade de Tecnologia de Campinas,FATEC CAMPINAS,Pública Estadual,Faculdade,Sudeste,São Paulo
55,15687,Faculdade de Tecnologia de Pindamonhangaba,FATEC PI,Pública Estadual,Faculdade,Sudeste,São Paulo
56,15784,Faculdade de Tecnologia Estudante Rafael Almeida Camarinha - Marilia,Fatec Marilia,Pública Estadual,Faculdade,Sudeste,São Paulo
57,15693,Faculdade de Tecnologia de Itapetininga - Prof.Antônio Belizandro Barbosa Rezende,Fatec - Itapetininga,Pública Estadual,Faculdade,Sudeste,São Paulo
58,23705,FACULDADE DE TECNOLOGIA DE FRANCO DA ROCHA,,Pública Estadual,Faculdade,Sudeste,São Paulo
59,19500,Faculdade de Tecnologia de São Carlos,FATEC São Carlo,Pública Estadual,Faculdade,Sudeste,São Paulo
60,16410,Faculdade de Tecnologia de Catanduva,FATEC Catanduva,Pública Estadual,Faculdade,Sudeste,São Paulo
61,15576,Faculdade de Tecnologia de Mogi das Cruzes,FATEC-MC,Pública Estadual,Faculdade,Sudeste,São Paulo
62,36,FACULDADE DE TECNOLOGIA RUBENS LARA,FATEC-BS,Pública Estadual,Faculdade,Sudeste,São Paulo
63,19862,Faculdade de Tecnologia Jorge Caram Sabbag,FATEC Bebedouro,Pública Estadual,Faculdade,Sudeste,São Paulo
64,15769,Faculdade de Tecnologia de Jales,Fatec Jales,Pública Estadual,Faculdade,Sudeste,São Paulo
65,17952,Faculdade de Tecnologia de Jacareí,FATEC Jacareí,Pública Estadual,Faculdade,Sudeste,São Paulo
66,15745,Faculdade de Tecnologia de São Caetano do Sul,FATEC SCS,Pública Estadual,Faculdade,Sudeste,São Paulo
67,15708,Faculdade de Tecnologia Dr. Thomaz Novelino,FATEC Franca,Pública Estadual,Faculdade,Sudeste,São Paulo
68,15704,Faculdade de Tecnologia de Capão Bonito,FATEC-CB,Pública Estadual,Faculdade,Sudeste,São Paulo
69,15793,Faculdade de Tecnologia de São Sebastião,Fatec SS,Pública Estadual,Faculdade,Sudeste,São Paulo
70,16395,Faculdade de Tecnologia de Carapicuiba,FATEC,Pública Estadual,Faculdade,Sudeste,São Paulo
71,18099,Faculdade de Tecnologia de Diadema Luigi Papaiz,FATEC DIADEMA,Pública Estadual,Faculdade,Sudeste,São Paulo
72,15697,Faculdade de Tecnologia de Araçatuba,FATEC Araçatuba,Pública Estadual,Faculdade,Sudeste,São Paulo
73,35,FACULDADE DE TECNOLOGIA DE AMERICANA,FATEC-AM,Pública Estadual,Faculdade,Sudeste,São Paulo
74,15689,Faculdade de Tecnologia de Bauru,FATEC,Pública Estadual,Faculdade,Sudeste,São Paulo
75,4022,FACULDADE DE TECNOLOGIA DE JUNDIAÍ,FATEC/JD,Pública Estadual,Faculdade,Sudeste,São Paulo
76,15680,Fatec Cruzeiro - Prof. Waldomiro May,,Pública Estadual,Faculdade,Sudeste,São Paulo
77,15752,Faculdade de Tecnologia de Guarulhos,FATEC GR,Pública Estadual,Faculdade,Sudeste,São Paulo
78,4020,FACULDADE DE TECNOLOGIA DE BOTUCATU,FATEC BT,Pública Estadual,Faculdade,Sudeste,São Paulo
79,23700,Faculdade de Tecnologia de Ferraz de Vasconcelos,,Pública Estadual,Faculdade,Sudeste,São Paulo
80,1583,FACULDADE DE TECNOLOGIA DE INDAIATUBA,FATEC-ID,Pública Estadual,Faculdade,Sudeste,São Paulo
81,17953,Faculdade de Tecnologia de Pompeia - Shunji Nishimura,FATEC Pompeia,Pública Estadual,Faculdade,Sudeste,São Paulo
82,19863,Faculdade de Tecnologia de Assis,FATEC Assis,Pública Estadual,Faculdade,Sudeste,São Paulo
83,4926,FACULDADE DE TECNOLOGIA DE PRAIA GRANDE,FATECPG,Pública Estadual,Faculdade,Sudeste,São Paulo
84,22939,Faculdade de Tecnologia de Araraquara,FATEC ARQ,Pública Estadual,Faculdade,Sudeste,São Paulo
85,1584,FACULDADE DE TECNOLOGIA DE GUARATINGUETÁ,FATEC GT,Pública Estadual,Faculdade,Sudeste,São Paulo
86,5633,FACULDADE DE TECNOLOGIA DE BRAGANÇA PAULISTA,,Pública Estadual,Faculdade,Sudeste,São Paulo
87,4026,FACULDADE DE TECNOLOGIA ZONA LESTE,FATEC-ZL,Pública Estadual,Faculdade,Sudeste,São Paulo
88,17977,Faculdade de Tecnologia de Itaquera,FATEC ITAQUERA,Pública Estadual,Faculdade,Sudeste,São Paulo
89,23867,Faculdade de Tecnologia de Sumaré,Fatec de Sumaré,Pública Estadual,Faculdade,Sudeste,São Paulo
90,22319,Faculdade de Tecnologia de Itatiba,Fatec Itatiba,Pública Estadual,Faculdade,Sudeste,São Paulo
91,5099,FACULDADE DE TECNOLOGIA DE SÃO BERNARDO DO CAMPO,FATEC-SB,Pública Estadual,Faculdade,Sudeste,São Paulo
92,34,FACULDADE DE TECNOLOGIA DE SÃO PAULO,FATEC-SP,Pública Estadual,Faculdade,Sudeste,São Paulo
93,15688,FACULDADE DE TECONOLOGIA DA ZONA SUL,FATEC ZONASUL,Pública Estadual,Faculdade,Sudeste,São Paulo
94,21713,Faculdade de Tecnologia - Fatec de Ribeirão Preto,,Pública Estadual,Faculdade,Sudeste,São Paulo
95,20478,Faculdade de Tecnologia de Santana de Parnaíba,FATEC-SPB,Pública Estadual,Faculdade,Sudeste,São Paulo
96,1874,FACULDADE DE TECNOLOGIA DE OURINHOS,FATEC,Pública Estadual,Faculdade,Sudeste,São Paulo
97,38,UNIVERSIDADE DO ESTADO DO PARÁ,UEPA,Pública Estadual,Universidade,Norte,Pará
98,40,UNIVERSIDADE DO ESTADO DA BAHIA,UNEB,Pública Estadual,Universidade,Nordeste,Bahia
99,9,UNIVERSIDADE ESTADUAL DE LONDRINA,UEL,Pública Estadual,Universidade,Sul,Paraná
100,730,UNIVERSIDADE ESTADUAL DE PONTA GROSSA,UEPG,Pública Estadual,Universidade,Sul,Paraná
101,18492,Universidade Estadual do Paraná,UNESPAR,Pública Estadual,Universidade,Sul,Paraná
102,609,UNIVERSIDADE ESTADUAL DO OESTE DO PARANÁ,UNIOESTE,Pública Estadual,Universidade,Sul,Paraná
103,1126,UNIVERSIDADE ESTADUAL DO CENTRO OESTE,UNICENTRO,Pública Estadual,Universidade,Sul,Paraná
104,57,UNIVERSIDADE ESTADUAL DE MARINGÁ,UEM,Pública Estadual,Universidade,Sul,Paraná
105,43,FUNDAÇÃO UNIVERSIDADE DO ESTADO DE SANTA CATARINA,UDESC,Pública Estadual,Universidade,Sul,Santa Catarina
106,1869,CENTRO UNIVERSITÁRIO DE ITAJUBÁ,FEPI,Privada sem fins lucrativos,Centro Universitário,Sudeste,Minas Gerais
107,47,UNIVERSIDADE ESTADUAL DE GOIÁS,UEG,Pública Estadual,Universidade,Centro-Oeste,Goiás
108,149,FACULDADE DE MEDICINA DE SÃO JOSÉ DO RIO PRETO,FAMERP,Pública Estadual,Faculdade,Sudeste,São Paulo
109,59,FACULDADE DE DIREITO DE FRANCA,FDF,Pública Municipal,Faculdade,Sudeste,São Paulo
110,1870,FACULDADES INTEGRADAS REGIONAIS DE AVARÉ,FIRA,Pública Municipal,Faculdade,Sudeste,São Paulo
111,3641,CENTRO UNIVERSITÁRIO DA FUNDAÇÃO EDUCACIONAL DE BARRETOS,UNIFEB,Privada sem fins lucrativos,Centro Universitário,Sudeste,São Paulo
112,67,ESCOLA DE ENGENHARIA DE PIRACICABA,EEP/FUMEP,Pública Municipal,Faculdade,Sudeste,São Paulo
113,68,FACULDADE DE FILOSOFIA CIÊNCIAS E LETRAS DE PENÁPOLIS,FAFIPE,Pública Municipal,Faculdade,Sudeste,São Paulo
114,71,UNIVERSIDADE DO ESTADO DO RIO GRANDE DO NORTE,UERN,Pública Estadual,Universidade,Nordeste,Rio Grande do Norte
115,4356,FACULDADE DE CIÊNCIAS SOCIAIS DOS PALMARES,FACIP,Especial,Faculdade,Nordeste,Pernambuco
116,72,FACULDADE DE FORMAÇÃO DE PROFESSORES DA MATA SUL,FAMASUL,Especial,Faculdade,Nordeste,Pernambuco
117,73,CENTRO DE ENSINO SUPERIOR DE ARCOVERDE,CESA,Especial,Faculdade,Nordeste,Pernambuco
118,4858,ESCOLA SUPERIOR DE SAÚDE DE ARCOVERDE,ESSA,Especial,Faculdade,Nordeste,Pernambuco
119,76,UNIVERSIDADE REGIONAL DE BLUMENAU,FURB,Pública Municipal,Universidade,Sul,Santa Catarina
120,78,FACULDADE DE FILOSOFIA CIÊNCIAS E LETRAS DE ALEGRE,FAFIA,Pública Municipal,Faculdade,Sudeste,Espírito Santo
121,79,INSTITUTO MUNICIPAL DE ENSINO SUPERIOR DE CATANDUVA,IMES CATANDUVA,Pública Municipal,Faculdade,Sudeste,São Paulo
122,80,CENTRO UNIVERSITÁRIO PARA O DESENVOLVIMENTO DO ALTO VALE DO ITAJAÍ,UNIDAVI,Privada sem fins lucrativos,Centro Universitário,Sul,Santa Catarina
123,81,UNIVERSIDADE DA REGIÃO DE JOINVILLE,UNIVILLE,Privada sem fins lucrativos,Universidade,Sul,Santa Catarina
124,82,UNIVERSIDADE DO OESTE DE SANTA CATARINA,UNOESC,Privada sem fins lucrativos,Universidade,Sul,Santa Catarina
125,1783,FACULDADE DE CIÊNCIAS SOCIAIS APLICADAS,FACISA,Privada sem fins lucrativos,Faculdade,Sul,Santa Catarina
126,83,UNIVERSIDADE DO VALE DO ITAJAÍ,UNIVALI,Privada sem fins lucrativos,Universidade,Sul,Santa Catarina
127,84,FACULDADE DE FILOSOFIA CIÊNCIAS E LETRAS DE MACAÉ,FAFIMA,Privada sem fins lucrativos,Faculdade,Sudeste,Rio de Janeiro
128,5671,CENTRO UNIVERSITÁRIO SÃO JOSÉ DE ITAPERUNA,,Privada sem fins lucrativos,Centro Universitário,Sudeste,Rio de Janeiro
129,87,CENTRO UNIVERSITÁRIO DE BRUSQUE,UNIFEBE,Privada sem fins lucrativos,Centro Universitário,Sul,Santa Catarina
130,18874,FACULDADE RAIMUNDO MARINHO DE PENEDO,,Privada sem fins lucrativos,Faculdade,Nordeste,Alagoas
131,5228,FACULDADE RAIMUNDO MARINHO,FRM,Privada sem fins lucrativos,Faculdade,Nordeste,Alagoas
132,3974,UNIVERSIDADE DE RIO VERDE,FESURV,Pública Municipal,Universidade,Centro-Oeste,Goiás
133,94,ESCOLA SUPERIOR DE EDUCAÇÃO FÍSICA DE JUNDIAÍ,ESEFJ,Pública Municipal,Faculdade,Sudeste,São Paulo
134,93,FACULDADE DE MEDICINA DE JUNDIAÍ,FMJ,Pública Municipal,Faculdade,Sudeste,São Paulo
135,95,UNIVERSIDADE ESTADUAL VALE DO ACARAÚ,UVA,Pública Estadual,Universidade,Nordeste,Ceará
136,3972,CENTRO SUPERIOR DE ENSINO E PESQUISA DE MACHADO,CESEP,Privada sem fins lucrativos,Faculdade,Sudeste,Minas Gerais
137,3488,Centro de Ensino Superior de Conselheiro Lafaiete,CES-CL,Privada sem fins lucrativos,Faculdade,Sudeste,Minas Gerais
138,99,FACULDADE DE DIREITO DE CONSELHEIRO LAFAIETE,FDCL,Privada sem fins lucrativos,Faculdade,Sudeste,Minas Gerais
139,1575,CENTRO UNIVERSITÁRIO DO PLANALTO DE ARAXÁ,UNIARAXÁ,Privada sem fins lucrativos,Centro Universitário,Sudeste,Minas Gerais
140,107,UNIVERSIDADE FEDERAL DE SÃO JOÃO DEL REI,UFSJ,Pública Federal,Universidade,Sudeste,Minas Gerais
141,1844,FACULDADES INTEGRADAS STELLA MARIS DE ANDRADINA,FISMA,Privada sem fins lucrativos,Faculdade,Sudeste,São Paulo
142,1623,FACULDADE DE CIÊNCIAS AGRÁRIAS DE ANDRADINA,FCAA,Privada sem fins lucrativos,Faculdade,Sudeste,São Paulo
143,4962,CENTRO UNIVERSITÁRIO DE SETE LAGOAS,UNIFEMM,Privada sem fins lucrativos,Centro Universitário,Sudeste,Minas Gerais
144,1418,CENTRO UNIVERSITÁRIO TOLEDO,UNITOLEDO,Privada com fins lucrativos,Centro Universitário,Sudeste,São Paulo
145,1569,FACULDADES INTEGRADAS DE ARARAQUARA,FIAR,Privada sem fins lucrativos,Faculdade,Sudeste,São Paulo
146,124,UNIVERSIDADE DE ARARAQUARA,UNIARA,Privada sem fins lucrativos,Universidade,Sudeste,São Paulo
147,125,CENTRO UNIVERSITÁRIO DE ARARAS -,UNAR,Privada sem fins lucrativos,Centro Universitário,Sudeste,São Paulo
148,126,INSTITUTO NACIONAL DE TELECOMUNICAÇÕES,INATEL,Privada sem fins lucrativos,Faculdade,Sudeste,Minas Gerais
149,5312,Centro Universitário UNIFAAT,UNIFAAT,Privada com fins lucrativos,Centro Universitário,Sudeste,São Paulo
150,5394,INSTITUTO DE ENSINO SUPERIOR INTEGRADO-IESI,FENORD,Privada sem fins lucrativos,Faculdade,Sudeste,Minas Gerais
151,2575,FACULDADES INTEGRADAS SOARES DE OLIVEIRA,FISO,Privada sem fins lucrativos,Faculdade,Sudeste,São Paulo
152,2774,Centro Universitário UNIFAFIBE,FAFIBE,Privada sem fins lucrativos,Centro Universitário,Sudeste,São Paulo
153,137,CENTRO UNIVERSITÁRIO SAGRADO CORAÇÃO,UNISAGRADO,Privada sem fins lucrativos,Centro Universitário,Sudeste,São Paulo
154,138,CENTRO UNIVERSITÁRIO BARÃO DE MAUÁ,CBM,Privada sem fins lucrativos,Centro Universitário,Sudeste,São Paulo
155,22116,Faculdade de Miguel Pereira,FAMIPE,Privada sem fins lucrativos,Faculdade,Sudeste,Rio de Janeiro
156,22917,FACULDADE DE CIÊNCIAS MÉDICAS DE MARICÁ,,Privada sem fins lucrativos,Faculdade,Sudeste,Rio de Janeiro
157,140,UNIVERSIDADE DE VASSOURAS,,Privada sem fins lucrativos,Universidade,Sudeste,Rio de Janeiro
158,141,FACULDADE DE DIREITO DE VARGINHA - FADIVA,FADIVA,Privada sem fins lucrativos,Faculdade,Sudeste,Minas Gerais
159,143,UNIVERSIDADE DE UBERABA,UNIUBE,Privada sem fins lucrativos,Universidade,Sudeste,Minas Gerais
160,144,FACULDADE DE CIÊNCIAS HUMANAS DE OLINDA,FACHO,Privada sem fins lucrativos,Faculdade,Nordeste,Pernambuco
161,1129,CENTRO UNIVERSITÁRIO DO NORTE PAULISTA,UNORP,Privada sem fins lucrativos,Centro Universitário,Sudeste,São Paulo
162,150,UNIVERSIDADE DE SOROCABA,UNISO,Privada sem fins lucrativos,Universidade,Sudeste,São Paulo
163,2129,ESCOLA DE ECONOMIA DE SÃO PAULO,EESP,Privada sem fins lucrativos,Faculdade,Sudeste,São Paulo
164,3614,ESCOLA DE CIÊNCIAS SOCIAIS,,Privada sem fins lucrativos,Faculdade,Sudeste,Rio de Janeiro
165,2591,EPGE Escola Brasileira de Economia e Finanças,FGV EPGE,Privada sem fins lucrativos,Faculdade,Sudeste,Rio de Janeiro
166,1851,ESCOLA BRASILEIRA DE ADMINISTRAÇÃO PÚBLICA E DE EMPRESAS,EBAPE,Privada sem fins lucrativos,Faculdade,Sudeste,Rio de Janeiro
167,13695,ESCOLA DE MATEMÁTICA APLICADA,EMAp-FGV,Privada sem fins lucrativos,Faculdade,Sudeste,Rio de Janeiro
168,21952,FGV / Escola de Relações Internacionais,FGV/RI,Privada sem fins lucrativos,Faculdade,Sudeste,São Paulo
169,151,ESCOLA DE ADMINISTRAÇÃO DE EMPRESAS DE SÃO PAULO,FGV-EAESP,Privada sem fins lucrativos,Faculdade,Sudeste,São Paulo
170,2128,Escola de Direito de São Paulo - FGV DIREITO SP,FGV DIREITO SP,Privada sem fins lucrativos,Faculdade,Sudeste,São Paulo
171,2126,ESCOLA DE DIREITO DO RIO DE JANEIRO,DIREITO RIO,Privada sem fins lucrativos,Faculdade,Sudeste,Rio de Janeiro
172,1363,FACULDADE VISCONDE DE CAIRÚ,FAVIC,Privada sem fins lucrativos,Faculdade,Nordeste,Bahia
173,152,FACULDADE DE CIÊNCIAS CONTÁBEIS,FACIC,Privada sem fins lucrativos,Faculdade,Nordeste,Bahia
174,1036,UNIVERSIDADE DO ESTADO DE MINAS GERAIS,UEMG,Pública Estadual,Universidade,Sudeste,Minas Gerais
175,1557,UNIVERSIDADE FUMEC,FUMEC,Privada sem fins lucrativos,Universidade,Sudeste,Minas Gerais
176,158,CONSERVATÓRIO BRASILEIRO DE MÚSICA - CENTRO UNIVERSITÁRIO BRASILEIRO DE EDUCAÇÃO,CBM-UniCBE,Privada sem fins lucrativos,Centro Universitário,Sudeste,Rio de Janeiro
177,159,FACULDADE DE FILOSOFIA CIÊNCIAS E LETRAS DE CARUARU,FAFICA,Privada sem fins lucrativos,Faculdade,Nordeste,Pernambuco
178,160,FACULDADE FRASSINETTI DO RECIFE,FAFIRE,Privada sem fins lucrativos,Faculdade,Nordeste,Pernambuco
179,162,CENTRO UNIVERSITÁRIO BELAS ARTES DE SÃO PAULO,FEBASP,Privada sem fins lucrativos,Centro Universitário,Sudeste,São Paulo
180,862,FACULDADE ESTÁCIO DE SÁ DE CAMPO GRANDE,FESCG,Privada com fins lucrativos,Faculdade,Centro-Oeste,Mato Grosso do Sul
181,1486,FACULDADE ESTÁCIO DE SÁ DE VITÓRIA,FESV,Privada com fins lucrativos,Faculdade,Sudeste,Espírito Santo
182,1496,FACULDADE ESTÁCIO DE SÁ DE VILA VELHA,FESVV,Privada com fins lucrativos,Faculdade,Sudeste,Espírito Santo
183,1509,Centro Universitário Estácio de Belo Horizonte - Estácio BH,ESTÁCIO BH,Privada com fins lucrativos,Centro Universitário,Sudeste,Minas Gerais
184,1659,FACULDADE ESTÁCIO DE SÁ DE OURINHOS,FAESO,Privada com fins lucrativos,Faculdade,Sudeste,São Paulo
185,22191,Faculdade Estácio de Jaraguá do Sul,Estácio Jaraguá,Privada com fins lucrativos,Faculdade,Sul,Santa Catarina
186,1986,CENTRO UNIVERSITÁRIO ESTÁCIO JUIZ DE FORA - ESTÁCIO JUIZ DE FORA,,Privada com fins lucrativos,Centro Universitário,Sudeste,Minas Gerais
187,163,UNIVERSIDADE ESTÁCIO DE SÁ,UNESA,Privada com fins lucrativos,Universidade,Sudeste,Rio de Janeiro
188,22076,Faculdade Estácio de Alagoinhas,,Privada com fins lucrativos,Faculdade,Nordeste,Bahia
189,2501,FACULDADE ESTÁCIO DE SÁ DE GOIÁS,FESGO,Privada com fins lucrativos,Faculdade,Centro-Oeste,Goiás
190,1510,CENTRO UNIVERSITÁRIO ESTÁCIO DE SANTA CATARINA - ESTÁCIO SANTA CATARINA,,Privada com fins lucrativos,Centro Universitário,Sul,Santa Catarina
191,1149,CENTRO UNIVERSITÁRIO NOSSA SENHORA DO PATROCÍNIO,CEUNSP,Privada com fins lucrativos,Centro Universitário,Sudeste,São Paulo
192,165,UNIVERSIDADE VEIGA DE ALMEIDA,UVA,Privada com fins lucrativos,Universidade,Sudeste,Rio de Janeiro
193,166,"FAI - CENTRO DE ENSINO SUPERIOR EM GESTÃO, TECNOLOGIA E EDUCAÇÃO",,Privada sem fins lucrativos,Faculdade,Sudeste,Minas Gerais
194,167,UNIVERSIDADE METODISTA DE SÃO PAULO,UMESP,Privada sem fins lucrativos,Universidade,Sudeste,São Paulo
195,171,FACULDADE DE DIREITO DO SUL DE MINAS,FDSM,Privada sem fins lucrativos,Faculdade,Sudeste,Minas Gerais
196,1586,UNIVERSIDADE DO VALE DO SAPUCAÍ,UNIVÁS,Privada sem fins lucrativos,Universidade,Sudeste,Minas Gerais
197,176,UNIVERSIDADE CASTELO BRANCO,UCB,Privada sem fins lucrativos,Universidade,Sudeste,Rio de Janeiro
198,3753,FACULDADES INTEGRADAS DOM PEDRO II,DOMPEDRO,Privada sem fins lucrativos,Faculdade,Sudeste,São Paulo
199,2409,CENTRO UNIVERSITÁRIO TABOSA DE ALMEIDA,ASCES-UNITA,Privada sem fins lucrativos,Centro Universitário,Nordeste,Pernambuco
200,1041,UNIVERSIDADE DO VALE DO TAQUARI,UNIVATES,Privada sem fins lucrativos,Universidade,Sul,Rio Grande do Sul
201,1153,UNIVERSIDADE CÂNDIDO MENDES,UCAM,Privada sem fins lucrativos,Universidade,Sudeste,Rio de Janeiro
202,191,FACULDADE DE CIÊNCIAS CONTÁBEIS E DE ADMINISTRAÇÃO DE EMPRESAS,FCCAE,Privada sem fins lucrativos,Faculdade,Sudeste,Rio de Janeiro
203,190,ESCOLA DE MEDICINA SOUZA MARQUES DA FUNDAÇÃO TÉCNICO-EDUCACIONAL SOUZA MARQUES,EMSM,Privada sem fins lucrativos,Faculdade,Sudeste,Rio de Janeiro
204,194,ESCOLA DE ENFERMAGEM DA FUNDAÇÃO TÉCNICO EDUCACIONAL SOUZA MARQUES,EEFTESM,Privada sem fins lucrativos,Faculdade,Sudeste,Rio de Janeiro
205,192,FACULDADE DE FILOSOFIA CIÊNCIAS E LETRAS SOUZA MARQUES,FFCLSM,Privada sem fins lucrativos,Faculdade,Sudeste,Rio de Janeiro
206,193,FACULDADE DE ENGENHARIA SOUZA MARQUES,FESM,Privada sem fins lucrativos,Faculdade,Sudeste,Rio de Janeiro
207,197,FACULDADE DE EDUCAÇÃO SUPERIOR DO PARANÁ,FESPPR,Privada sem fins lucrativos,Faculdade,Sul,Paraná
208,200,FACULDADE CÁSPER LÍBERO,FCL,Privada sem fins lucrativos,Faculdade,Sudeste,São Paulo
209,203,UNIVERSIDADE SÃO JUDAS TADEU,USJT,Privada com fins lucrativos,Universidade,Sudeste,São Paulo
210,1365,CENTRO UNIVERSITÁRIO ADVENTISTA DE SÃO PAULO,UNASP,Privada sem fins lucrativos,Centro Universitário,Sudeste,São Paulo
211,206,CENTRO UNIVERSITÁRIO ÍTALO-BRASILEIRO,UNIÍTALO,Privada sem fins lucrativos,Centro Universitário,Sudeste,São Paulo
212,207,CENTRO UNIVERSITÁRIO MOURA LACERDA,CUML,Privada sem fins lucrativos,Centro Universitário,Sudeste,São Paulo
213,208,UNIVERSIDADE DE RIBEIRÃO PRETO,UNAERP,Privada sem fins lucrativos,Universidade,Sudeste,São Paulo
214,2183,CENTRO UNIVERSITÁRIO FUNDAÇÃO SANTO ANDRÉ,CUFSA,Privada sem fins lucrativos,Centro Universitário,Sudeste,São Paulo
215,4502,FACULDADES INTEGRADAS CAMPO-GRANDENSES,FIC,Privada sem fins lucrativos,Faculdade,Sudeste,Rio de Janeiro
216,213,CENTRO UNIVERSITÁRIO ÁLVARES PENTEADO,FECAP,Privada sem fins lucrativos,Centro Universitário,Sudeste,São Paulo
217,214,FACULDADE DE ENGENHARIA DE MINAS GERAIS - FEAMIG,FEAMIG,Privada sem fins lucrativos,Faculdade,Sudeste,Minas Gerais
218,216,CENTRO UNIVERSITÁRIO METODISTA IZABELA HENDRIX,CEUNIH,Privada sem fins lucrativos,Centro Universitário,Sudeste,Minas Gerais
219,217,CENTRO UNIVERSITÁRIO DAS FACULDADES ASSOCIADAS DE ENSINO - FAE,UNIFAE,Especial,Centro Universitário,Sudeste,São Paulo
220,219,FACULDADE DE EDUCAÇÃO CIÊNCIAS E ARTES DOM BOSCO DE MONTE APRAZÍVEL,FAECA DOM BOSCO,Privada sem fins lucrativos,Faculdade,Sudeste,São Paulo
221,220,FACULDADE SÃO JUDAS TADEU,FSJT,Privada sem fins lucrativos,Faculdade,Sudeste,Rio de Janeiro
222,221,UNIVERSIDADE CRUZEIRO DO SUL,UNICSUL,Privada com fins lucrativos,Universidade,Sudeste,São Paulo
223,222,CENTRO UNIVERSITÁRIO DE VOTUPORANGA,UNIFEV,Privada sem fins lucrativos,Centro Universitário,Sudeste,São Paulo
224,224,Centro Universitário Saúde ABC,CUSABC,Privada sem fins lucrativos,Centro Universitário,Sudeste,São Paulo
225,226,CENTRO UNIVERSITÁRIO LUSÍADA,UNILUS,Privada sem fins lucrativos,Centro Universitário,Sudeste,São Paulo
226,227,UNIVERSIDADE CATÓLICA DE SANTOS,UNISANTOS,Privada sem fins lucrativos,Universidade,Sudeste,São Paulo
227,1878,CENTRO UNIVERSITÁRIO DA FUNDAÇÃO EDUCACIONAL INACIANA PE SABÓIA DE MEDEIROS,FEI,Privada sem fins lucrativos,Centro Universitário,Sudeste,São Paulo
228,231,FACULDADE DE SÃO BERNARDO DO CAMPO - FASB,FASB I,Privada sem fins lucrativos,Faculdade,Sudeste,São Paulo
229,1445,CENTRO UNIVERSITÁRIO DO INSTITUTO MAUÁ DE TECNOLOGIA,CEUN-IMT,Privada sem fins lucrativos,Centro Universitário,Sudeste,São Paulo
230,234,FACULDADES OSWALDO CRUZ,FOC,Privada com fins lucrativos,Faculdade,Sudeste,São Paulo
