,CODIGO_IES,NOME_IES,SIGLA_IES,TIPO_CATEGORIA_ADM,TIPO_ORG_ACADEMICA,REGIAO,UF
683,1012,FACULDADE DO SERTÃO DO PAJEÚ,FASP,Especial,Faculdade,Nordeste,Pernambuco
684,1014,INSTITUTO SUPERIOR E CENTRO EDUCACIONAL LUTERANO - BOM JESUS - IELUSC,BOM JESUS/IELUSC,Privada sem fins lucrativos,Faculdade,Sul,Santa Catarina
685,5369,FACULDADES INTEGRADAS ASMEC,ASMEC,Privada com fins lucrativos,Faculdade,Sudeste,Minas Gerais
686,1225,CENTRO UNIVERSITÁRIO AMPARENSE,UNIFIA,Privada com fins lucrativos,Centro Universitário,Sudeste,São Paulo
687,828,FACULDADE DE SÃO LOURENÇO,FASAMA,Privada com fins lucrativos,Faculdade,Sudeste,Minas Gerais
688,4185,FACULDADE PERUIBE,FPBE,Privada com fins lucrativos,Faculdade,Sudeste,São Paulo
689,1554,CENTRO UNIVERSITÁRIO DO VALE DO RIBEIRA,UNIVR,Privada com fins lucrativos,Centro Universitário,Sudeste,São Paulo
690,3823,INSTITUTO DE EDUCAÇÃO SUPERIOR DE POUSO ALEGRE,,Privada com fins lucrativos,Faculdade,Sudeste,Minas Gerais
691,1019,FACULDADE DE CIÊNCIAS E TECNOLOGIA DE UNAÍ - FACTU,FACTU,Privada sem fins lucrativos,Faculdade,Sudeste,Minas Gerais
692,1170,FACULDADE METROPOLITANA DE CAMAÇARI,FAMEC,Privada sem fins lucrativos,Faculdade,Nordeste,Bahia
693,17116,Faculdade de Ciências de Goiana,FCG,Privada sem fins lucrativos,Faculdade,Nordeste,Pernambuco
694,1021,FACULDADE DE CIÊNCIAS DE TIMBAÚBA,FACET,Privada sem fins lucrativos,Faculdade,Nordeste,Pernambuco
695,1143,Faculdade de Ciências de Timbaúba,FACET,Privada sem fins lucrativos,Faculdade,Nordeste,Pernambuco
696,1028,UNIVERSIDADE ESTADUAL DE MATO GROSSO DO SUL,UEMS,Pública Estadual,Universidade,Centro-Oeste,Mato Grosso do Sul
697,1049,INSTITUTO DE ENSINO SUPERIOR FUCAPI,CESF,Privada sem fins lucrativos,Faculdade,Norte,Amazonas
698,1051,FACULDADE DA SEUNE,SEUNE,Privada com fins lucrativos,Faculdade,Nordeste,Alagoas
699,3754,FACULDADES INTEGRADAS ADVENTISTAS DE MINAS GERAIS,FADMINAS,Privada sem fins lucrativos,Faculdade,Sudeste,Minas Gerais
700,1123,INSTITUTO DE EDUCAÇÃO SUPERIOR UNYAHNA DE SALVADOR,IESUS,Privada com fins lucrativos,Faculdade,Nordeste,Bahia
701,1055,Centro Universitário Maurício de Nassau de Salvador,Uninassau Salvador,Privada sem fins lucrativos,Centro Universitário,Nordeste,Bahia
702,1060,CENTRO UNIVERSITÁRIO DO INSTITUTO DE EDUCAÇÃO SUPERIOR DE BRASÍLIA - IESB,IESB,Privada com fins lucrativos,Centro Universitário,Centro-Oeste,Distrito Federal
703,1428,INSTITUTO DE ENSINO SUPERIOR PLANALTO,IESPLAN,Privada com fins lucrativos,Faculdade,Centro-Oeste,Distrito Federal
704,1067,FACULDADE DE JUSSARA,FAJ,Privada com fins lucrativos,Faculdade,Centro-Oeste,Goiás
705,1068,FACULDADE ALDETE MARIA ALVES,FAMA,Privada sem fins lucrativos,Faculdade,Sudeste,Minas Gerais
706,1071,INSTITUTO DE ENSINO SUPERIOR DA FUNLEC,IESF,Privada sem fins lucrativos,Faculdade,Centro-Oeste,Mato Grosso do Sul
707,3805,FACULDADE DE TECNOLOGIA DA PARAÍBA,FATECPB,Privada com fins lucrativos,Faculdade,Nordeste,Paraíba
708,1075,CENTRO UNIVERSITÁRIO - UNIESP,UNIESP,Privada com fins lucrativos,Centro Universitário,Nordeste,Paraíba
709,1076,"FACULDADE DE FILOSOFIA, CIÊNCIAS E LETRAS DE CAJAZEIRAS",FAFIC,Privada sem fins lucrativos,Faculdade,Nordeste,Paraíba
710,1079,FACULDADE MARINGÁ,CESPAR,Privada sem fins lucrativos,Faculdade,Sul,Paraná
711,1085,FACULDADE METODISTA CENTENÁRIO,FMC,Privada sem fins lucrativos,Faculdade,Sul,Rio Grande do Sul
712,19172,Faculdades Integradas Aparício Carvalho Vilhena,FIMCAVILHENA,Privada com fins lucrativos,Faculdade,Norte,Rondônia
713,1087,CENTRO UNIVERSITÁRIO APARÍCIO CARVALHO,,Privada sem fins lucrativos,Centro Universitário,Norte,Rondônia
714,1090,FACULDADE SÃO LUÍS DE FRANÇA,FSLF,Privada com fins lucrativos,Faculdade,Nordeste,Sergipe
715,1092,FACULDADES INTEGRADAS DE BAURU,FIB,Privada com fins lucrativos,Faculdade,Sudeste,São Paulo
716,1174,FACULDADE DE SABARÁ,SOECS,Privada sem fins lucrativos,Faculdade,Sudeste,Minas Gerais
717,3692,FACULDADE DE TECNOLOGIA IPEP DE CAMPINAS,FATEC CAMPINAS,Privada sem fins lucrativos,Faculdade,Sudeste,São Paulo
718,1385,FACULDADES INTEGRADAS IPEP,FIPEP,Privada sem fins lucrativos,Faculdade,Sudeste,São Paulo
719,15508,Centro de Ensino Unificado do Piauí,CEUPI,Privada sem fins lucrativos,Faculdade,Nordeste,Piauí
720,22131,CENTRO DE ENSINO SUPERIOR DO TOCANTINS,,Privada sem fins lucrativos,Faculdade,Norte,Tocantins
721,4450,CENTRO UNIVERSITÁRIO METROPOLITANO DA AMAZÔNIA,UNIFAMAZ,Privada sem fins lucrativos,Centro Universitário,Norte,Pará
722,21892,CENTRO DE ENSINO SUPERIOR DE PALMAS,CESUP,Privada sem fins lucrativos,Faculdade,Norte,Tocantins
723,1113,CENTRO UNIVERSITÁRIO EURO-AMERICANO,UNIEURO,Privada sem fins lucrativos,Centro Universitário,Centro-Oeste,Distrito Federal
724,1115,FACULDADE SANTA TEREZINHA,CEST,Privada sem fins lucrativos,Faculdade,Nordeste,Maranhão
725,738,CENTRO UNIVERSITÁRIO TERESA D'ÁVILA,FATEA,Privada sem fins lucrativos,Centro Universitário,Sudeste,São Paulo
726,545,FACULDADE DE DESENVOLVIMENTO DAS CIÊNCIAS E HUMANIDADES,FADECH,Privada sem fins lucrativos,Faculdade,Sudeste,Minas Gerais
727,4938,FACULDADE CLARETIANA DE TEOLOGIA,,Privada sem fins lucrativos,Faculdade,Sul,Paraná
728,135,CENTRO UNIVERSITÁRIO CLARETIANO,CEUCLAR,Privada sem fins lucrativos,Centro Universitário,Sudeste,São Paulo
729,1854,CLARETIANO - CENTRO UNIVERSITÁRIO,,Privada sem fins lucrativos,Centro Universitário,Sudeste,São Paulo
730,1131,CENTRO UNIVERSITÁRIO SANTO AGOSTINHO,UNIFSA,Privada com fins lucrativos,Centro Universitário,Nordeste,Piauí
731,1136,FACULDADE DE CIÊNCIAS HUMANAS E SOCIAIS DE IGARASSU,FACIG,Privada sem fins lucrativos,Faculdade,Nordeste,Pernambuco
732,1360,iCEV - Instituto de Ensino Superior,,Privada com fins lucrativos,Faculdade,Nordeste,Piauí
733,1141,CENTRO UNIVERSITÁRIO GAMA E SOUZA,,Privada sem fins lucrativos,Centro Universitário,Sudeste,Rio de Janeiro
734,1144,FACULDADE DE CIÊNCIAS HUMANAS,IMENSU,Privada sem fins lucrativos,Faculdade,Sudeste,São Paulo
735,1379,FACULDADES INTEGRADAS SÃO PEDRO,FAESA,Privada sem fins lucrativos,Faculdade,Sudeste,Espírito Santo
736,1151,FACULDADE DE ADMINISTRAÇÃO E NEGÓCIOS DE SERGIPE,FANESE,Privada com fins lucrativos,Faculdade,Nordeste,Sergipe
737,1157,ESCOLA SUPERIOR SÃO FRANCISCO DE ASSIS,ESFA,Privada sem fins lucrativos,Faculdade,Sudeste,Espírito Santo
738,1159,CENTRO DE ENSINO SUPERIOR DE VITÓRIA,CESV,Privada com fins lucrativos,Faculdade,Sudeste,Espírito Santo
739,1160,FACULDADE CAMBURY,CAMBURY,Privada com fins lucrativos,Faculdade,Centro-Oeste,Goiás
740,14609,FACULDADE DE TECNOLOGIA SENAI CONDE JOSÉ VICENTE DE AZEVEDO,,Privada sem fins lucrativos,Faculdade,Sudeste,São Paulo
741,4817,FACULDADE DE TECNOLOGIA SENAI ANCHIETA,,Privada sem fins lucrativos,Faculdade,Sudeste,São Paulo
742,4814,FACULDADE DE TECNOLOGIA SENAI FELIX GUISARD,,Privada sem fins lucrativos,Faculdade,Sudeste,São Paulo
743,4815,FACULDADE DE TECNOLOGIA SENAI NADIR DIAS DE FIGUEIREDO,,Privada sem fins lucrativos,Faculdade,Sudeste,São Paulo
744,1150,Faculdade de Tecnologia Senai Theobaldo de Nigris,SP SENAI,Privada sem fins lucrativos,Faculdade,Sudeste,São Paulo
745,4819,FACULDADE DE TECNOLOGIA SENAI MARIANO FERRAZ,,Privada sem fins lucrativos,Faculdade,Sudeste,São Paulo
746,1286,Faculdade de Tecnologia Senai Mario Amato,SENAI,Privada sem fins lucrativos,Faculdade,Sudeste,São Paulo
747,17516,Faculdade de Tecnologia do SENAI Horácio Augusto da Silveira,,Privada sem fins lucrativos,Faculdade,Sudeste,São Paulo
748,15502,Faculdade de Tecnologia SENAI Suiço-Brasileira Paulo Ernesto Tolle,,Privada sem fins lucrativos,Faculdade,Sudeste,São Paulo
749,1195,FACULDADE SENAI DE TECNOLOGIA MECATRÔNICA,SENAI,Privada sem fins lucrativos,Faculdade,Sudeste,São Paulo
750,1526,FACULDADE DE TECNOLOGIA SENAI ANTOINE SKAF,SENAI,Privada sem fins lucrativos,Faculdade,Sudeste,São Paulo
751,4820,FACULDADE DE TECNOLOGIA SENAI ANTÔNIO ADOLPHO LOBBE,,Privada sem fins lucrativos,Faculdade,Sudeste,São Paulo
752,17691,FACULDADE DE TECNOLOGIA SENAI GASPAR RICARDO JUNIOR,,Privada sem fins lucrativos,Faculdade,Sudeste,São Paulo
753,17690,FACULDADE DE TECNOLOGIA SENAI ROBERTO MANGE,,Privada sem fins lucrativos,Faculdade,Sudeste,São Paulo
754,15501,Faculdade de Tecnologia SENAI Roberto Simonsen,,Privada sem fins lucrativos,Faculdade,Sudeste,São Paulo
755,1175,FACULDADE ESTÁCIO DO RIO GRANDE DO SUL - ESTÁCIO FARGS,ESTÁCIO FARGS,Privada sem fins lucrativos,Faculdade,Sul,Rio Grande do Sul
756,1185,CENTRO UNIVERSITÁRIO JORGE AMADO,UNIJORGE,Privada com fins lucrativos,Centro Universitário,Nordeste,Bahia
757,370,FACULDADE PAULISTA DE ARTES,FPA,Privada sem fins lucrativos,Faculdade,Sudeste,São Paulo
758,1191,INSTITUTO DE ENSINO SUPERIOR DE FORTALEZA,IESF,Privada sem fins lucrativos,Faculdade,Nordeste,Ceará
759,1192,FACULDADE DE CIÊNCIAS DA SAÚDE DE SÃO PAULO,FACIS,Privada com fins lucrativos,Faculdade,Sudeste,São Paulo
760,1198,FACULDADE DE CIÊNCIAS SOCIAIS E APLICADAS DO PARANÁ,FACET,Privada com fins lucrativos,Faculdade,Sul,Paraná
761,1202,FACULDADE SANTA RITA,FASAR,Privada com fins lucrativos,Faculdade,Sudeste,Minas Gerais
762,1205,FACULDADE EDUCACIONAL DA LAPA,FAEL,Privada com fins lucrativos,Faculdade,Sul,Paraná
763,1208,FAL ESTÁCIO - FACULDADE ESTÁCIO DE NATAL,,Privada sem fins lucrativos,Faculdade,Nordeste,Rio Grande do Norte
764,4157,FACULDADE METROPOLITANA DE RIO DO SUL,FAMESUL,Privada com fins lucrativos,Faculdade,Sul,Santa Catarina
765,2175,CENTRO UNIVERSITÁRIO DANTE,,Privada com fins lucrativos,Centro Universitário,Sul,Santa Catarina
766,1472,CENTRO UNIVERSITÁRIO LEONARDO DA VINCI,UNIASSELVI,Privada com fins lucrativos,Centro Universitário,Sul,Santa Catarina
767,2755,FACULDADE DO VALE DO ITAJAÍ MIRIM,FAVIM,Privada com fins lucrativos,Faculdade,Sul,Santa Catarina
768,16914,Faculdade Leonardo da Vinci - Santa Catarina,,Privada com fins lucrativos,Faculdade,Sul,Santa Catarina
769,1958,FACULDADE DE TECNOLOGIA SENAI BLUMENAU,CET BLUMENAU,Privada sem fins lucrativos,Faculdade,Sul,Santa Catarina
770,1957,FACULDADE DE TECNOLOGIA SENAI JOINVILLE,SENAI DE JOINVILLE,Privada sem fins lucrativos,Faculdade,Sul,Santa Catarina
771,1763,FACULDADE DE TECNOLOGIA SENAI CHAPECÓ,SENAI,Privada sem fins lucrativos,Faculdade,Sul,Santa Catarina
772,3155,FACULDADE DE TECNOLOGIA SENAI JARAGUÁ DO SUL,FATEC,Privada sem fins lucrativos,Faculdade,Sul,Santa Catarina
773,3159,FACULDADE DE TECNOLOGIA SENAI FLORIANÓPOLIS,SENAI -SC - CTAI,Privada sem fins lucrativos,Faculdade,Sul,Santa Catarina
774,1219,INSTITUTO ITAPETININGANO DE ENSINO SUPERIOR,IIES,Privada com fins lucrativos,Faculdade,Sudeste,São Paulo
775,1227,CENTRO UNIVERSITÁRIO SÃO FRANCISCO DE BARREIRAS,,Privada sem fins lucrativos,Centro Universitário,Nordeste,Bahia
776,1237,FACULDADE NOSSA SENHORA APARECIDA,FANAP,Privada sem fins lucrativos,Faculdade,Centro-Oeste,Goiás
777,1239,FACULDADE PADRÃO,PADRAO,Privada com fins lucrativos,Faculdade,Centro-Oeste,Goiás
778,2073,INSTITUTO SUPERIOR DE EDUCAÇÃO PADRÃO,ISE-PADRAO,Privada com fins lucrativos,Faculdade,Centro-Oeste,Goiás
779,2442,FACULDADE DE CIÊNCIAS BIOMÉDICAS DO ESPÍRITO SANTO,PIO XII - BIO,Privada sem fins lucrativos,Faculdade,Sudeste,Espírito Santo
780,2351,FACULDADE ESPÍRITO SANTENSE DE CIÊNCIAS JURÍDICAS,PIO XII - DIR,Privada sem fins lucrativos,Faculdade,Sudeste,Espírito Santo
781,1240,FACULDADE DE ESTUDOS SOCIAIS DO ESPÍRITO SANTO,PIO XII,Privada sem fins lucrativos,Faculdade,Sudeste,Espírito Santo
782,23318,FACULDADE BRASILEIRA DE CACHOEIRO,,Privada com fins lucrativos,Faculdade,Sudeste,Espírito Santo
783,1244,FACULDADE BRASILEIRA,MULTIVIX VITÓRIA,Privada com fins lucrativos,Faculdade,Sudeste,Espírito Santo
784,1245,Faculdade de Castelo - Multivix Castelo,Multivix Castelo,Privada com fins lucrativos,Faculdade,Sudeste,Espírito Santo
785,1970,FACULDADE DO ESPÍRITO SANTO,UNES,Privada com fins lucrativos,Faculdade,Sudeste,Espírito Santo
786,1248,FACULDADE DE PEDAGOGIA,ANAEC,Privada sem fins lucrativos,Faculdade,Centro-Oeste,Mato Grosso do Sul
787,1249,FACULDADE DE EDUCAÇÃO DE COSTA RICA,FECRA,Privada sem fins lucrativos,Faculdade,Centro-Oeste,Mato Grosso do Sul
788,1253,FACULDADE METODISTA GRANBERY,FMG,Privada sem fins lucrativos,Faculdade,Sudeste,Minas Gerais
789,1256,FACULDADE DOM BOSCO,DOM BOSCO,Privada sem fins lucrativos,Faculdade,Sul,Paraná
790,5403,CENTRO UNIVERSITÁRIO OPET,Uniopet,Privada com fins lucrativos,Centro Universitário,Sul,Paraná
791,1263,FACULDADE BEZERRA DE ARAÚJO,FABA,Privada com fins lucrativos,Faculdade,Sudeste,Rio de Janeiro
792,1264,CENTRO UNIVERSITÁRIO DO RIO GRANDE DO NORTE,UNI-RN,Privada sem fins lucrativos,Centro Universitário,Nordeste,Rio Grande do Norte
793,1267,INSTITUTO DE ENSINO SUPERIOR DA GRANDE FLORIANÓPOLIS,IESGF,Privada com fins lucrativos,Faculdade,Sul,Santa Catarina
794,2174,FACULDADE DE SANTA CATARINA,FASC,Privada com fins lucrativos,Faculdade,Sul,Santa Catarina
795,1270,CENTRO UNIVERSITÁRIO ESTÁCIO DE RIBEIRÃO PRETO,ESTÁCIO RIBEIRÃO PRE,Privada com fins lucrativos,Centro Universitário,Sudeste,São Paulo
796,17803,Faculdade Estácio de Rio Preto,Estácio Rio Preto,Privada com fins lucrativos,Faculdade,Sudeste,São Paulo
797,1273,Centro Universitário Campo Limpo Paulista,UNIFACCAMP,Privada com fins lucrativos,Centro Universitário,Sudeste,São Paulo
798,1276,INSTITUTO TAUBATÉ DE ENSINO SUPERIOR,I.T.E.S.,Privada com fins lucrativos,Faculdade,Sudeste,São Paulo
799,1279,FACULDADE DE ITÁPOLIS - FACITA,FACITA,Privada com fins lucrativos,Faculdade,Sudeste,São Paulo
800,1281,FACULDADE DE CIÊNCIAS SOCIAIS E AGRÁRIAS DE ITAPEVA,FAIT,Privada com fins lucrativos,Faculdade,Sudeste,São Paulo
801,1294,Centro Universitário das Américas,CAM,Privada com fins lucrativos,Centro Universitário,Sudeste,São Paulo
802,4064,FACULDADE DE TECNOLOGIA FAMA,FAMA,Privada sem fins lucrativos,Faculdade,Nordeste,Pernambuco
803,1296,ESCOLA SUPERIOR DE MARKETING,ESM,Privada sem fins lucrativos,Faculdade,Nordeste,Pernambuco
804,1300,INSTITUTO TAQUARITINGUENSE DE ENSINO SUPERIOR DR. ARISTIDES DE CARVALHO SCHLOBACH,ITES,Privada sem fins lucrativos,Faculdade,Sudeste,São Paulo
805,1302,FACULDADE BATISTA BRASILEIRA,FBB,Privada sem fins lucrativos,Faculdade,Nordeste,Bahia
806,19284,FACULDADE BATISTA BRASILEIRA DO RECÔNCAVO,FBBR,Privada sem fins lucrativos,Faculdade,Nordeste,Bahia
807,1310,FACULDADE DE AMERICANA,FAM,Privada sem fins lucrativos,Faculdade,Sudeste,São Paulo
808,14878,TREVISAN ESCOLA SUPERIOR DE NEGÓCIOS-,TEN,Privada com fins lucrativos,Faculdade,Sudeste,São Paulo
809,13811,TREVISAN ESCOLA SUPERIOR DE NEGÓCIOS,,Privada com fins lucrativos,Faculdade,Sudeste,Rio de Janeiro
810,1311,TREVISAN ESCOLA SUPERIOR DE NEGÓCIOS,TREVISAN,Privada com fins lucrativos,Faculdade,Sudeste,São Paulo
811,1317,Centro Universitário Sudoeste Paulista,UniFSP,Privada com fins lucrativos,Centro Universitário,Sudeste,São Paulo
812,1318,FACULDADE UNINASSAU VITÓRIA DA CONQUISTA,,Privada com fins lucrativos,Faculdade,Nordeste,Bahia
813,13873,FACULDADE FINOM DE PATOS DE MINAS,FINOM,Privada com fins lucrativos,Faculdade,Sudeste,Minas Gerais
814,682,FACULDADE DO NOROESTE DE MINAS,FINOM,Privada com fins lucrativos,Faculdade,Sudeste,Minas Gerais
815,1319,FACULDADE TECSOMA,FATEC,Privada com fins lucrativos,Faculdade,Sudeste,Minas Gerais
816,4043,FACULDADE TECNOLOGIA EDUVALE - AVARÉ,FATEC EDUVALE,Privada sem fins lucrativos,Faculdade,Sudeste,São Paulo
817,1322,FACULDADE EDUVALE DE AVARÉ,EDUVALE,Privada sem fins lucrativos,Faculdade,Sudeste,São Paulo
818,1325,FACULDADE DE APUCARANA,FAP,Privada sem fins lucrativos,Faculdade,Sul,Paraná
819,1328,FACULDADE DE COMUNICAÇÃO E TURISMO DE OLINDA,FACOTTUR,Privada sem fins lucrativos,Faculdade,Nordeste,Pernambuco
820,1330,FACULDADE COTEMIG,COTEMIG,Privada com fins lucrativos,Faculdade,Sudeste,Minas Gerais
821,2491,INSTITUTO SUPERIOR DE EDUCAÇÃO DO CECAP,ISCECAP,Privada sem fins lucrativos,Faculdade,Centro-Oeste,Distrito Federal
822,1333,FACULDADE CECAP DO LAGO NORTE,CECAP,Privada sem fins lucrativos,Faculdade,Centro-Oeste,Distrito Federal
823,12625,ESCOLA SUPERIOR DE AVIAÇÃO CIVIL,ESAC,Privada com fins lucrativos,Faculdade,Nordeste,Paraíba
824,1334,CENTRO UNIVERSITÁRIO FACISA,UNIFACISA,Privada com fins lucrativos,Centro Universitário,Nordeste,Paraíba
825,5186,INSTITUTO ASSIS GURGACZ,,Privada sem fins lucrativos,Faculdade,Sul,Paraná
826,1612,Faculdade Assis Gurgacz,FAG TOLEDO,Privada sem fins lucrativos,Faculdade,Sul,Paraná
827,1336,CENTRO UNIVERSITÁRIO ASSIS GURGACZ,FAG,Privada sem fins lucrativos,Centro Universitário,Sul,Paraná
828,1337,FACULDADE MATER DEI,FMD,Privada com fins lucrativos,Faculdade,Sul,Paraná
829,1350,FACULDADE DO VALE DO JAGUARIBE,FVJ,Privada com fins lucrativos,Faculdade,Nordeste,Ceará
830,14028,Faculdade UNA de Betim,UNA,Privada com fins lucrativos,Faculdade,Sudeste,Minas Gerais
831,4766,FACULDADE UNA DE CONTAGEM,FUNAC,Privada com fins lucrativos,Faculdade,Sudeste,Minas Gerais
832,1618,CENTRO UNIVERSITÁRIO SOCIESC DE BLUMENAU,,Privada com fins lucrativos,Centro Universitário,Sul,Santa Catarina
833,22736,Faculdade SOCIESC de Itajaí,SOCIESC,Privada com fins lucrativos,Faculdade,Sul,Santa Catarina
834,4045,Centro Universitário SOCIESC de Curitiba,UNISOCIESC,Privada sem fins lucrativos,Centro Universitário,Sul,Paraná
835,3758,Faculdade SOCIESC,,Privada sem fins lucrativos,Faculdade,Sul,Santa Catarina
836,3691,FACULDADE DE TECNOLOGIA TUPY DE SÃO BENTO DO SUL,FTT-SBS,Privada sem fins lucrativos,Faculdade,Sul,Santa Catarina
837,3437,Faculdade SOCIESC de Balneário Camboriú,,Privada com fins lucrativos,Faculdade,Sul,Santa Catarina
838,19257,Faculdade Una de Divinópolis,Una Divinopolis,Privada com fins lucrativos,Faculdade,Sudeste,Minas Gerais
839,21415,FACULDADE UNA DE NOVA SERRANA,UNA,Privada com fins lucrativos,Faculdade,Sudeste,Minas Gerais
840,302,FACULDADE DIVINÓPOLIS,FACED,Privada com fins lucrativos,Faculdade,Sudeste,Minas Gerais
841,1351,CENTRO UNIVERSITÁRIO SOCIESC,,Privada sem fins lucrativos,Centro Universitário,Sul,Santa Catarina
842,18454,Faculdade Una de Sete Lagoas,Unaset,Privada com fins lucrativos,Faculdade,Sudeste,Minas Gerais
843,19865,Faculdade Una de Pouso Alegre,Una PousoAlegre,Privada com fins lucrativos,Faculdade,Sudeste,Minas Gerais
844,5017,FACULDADE DE EDUCAÇÃO TECNOLÓGICA DO ESTADO DO RIO DE JANEIRO - FAETERJ,FAETERJ PETRÓPOLIS,Pública Estadual,Faculdade,Sudeste,Rio de Janeiro
845,5051,FACULDADE DE EDUCAÇÃO TECNOLÓGICA DO ESTADO DO RIO DE JANEIRO - FAETERJ,FAETERJ BJ ITABAPOAN,Pública Estadual,Faculdade,Sudeste,Rio de Janeiro
846,5021,FACULDADE DE EDUCAÇÃO TECNOLÓGICA DO ESTADO DO RIO DE JANEIRO - FAETERJ,FAETERJ ITAPERUNA,Pública Estadual,Faculdade,Sudeste,Rio de Janeiro
847,5018,INSTITUTO SUPERIOR DE EDUCAÇÃO PROFESSOR ALDO MUYLAERT,ISEPAM,Pública Estadual,Faculdade,Sudeste,Rio de Janeiro
848,5016,FACULDADE DE EDUCAÇÃO TECNOLÓGICA DO ESTADO DO RIO DE JANEIRO - FAETERJ,FAETERJ R DE JANEIRO,Pública Estadual,Faculdade,Sudeste,Rio de Janeiro
849,23713,Faculdade de Educação Tecnológica Barra Mansa,FAETERJ B.MANSA,Pública Estadual,Faculdade,Sudeste,Rio de Janeiro
850,5020,FACULDADE DE EDUCAÇÃO TECNOLÓGICA DO ESTADO DO RIO DE JANEIRO - FAETERJ,FAETERJ S ANT. PÁDUA,Pública Estadual,Faculdade,Sudeste,Rio de Janeiro
851,1357,INSTITUTO SUPERIOR DE EDUCAÇÃO DO RIO DE JANEIRO,ISERJ,Pública Estadual,Faculdade,Sudeste,Rio de Janeiro
852,19588,Faculdade de Educação Tecnológica do Estado do Rio de Janeiro,FAETERJ CAXIAS,Pública Estadual,Faculdade,Sudeste,Rio de Janeiro
853,5053,FACULDADE DE EDUCAÇÃO TECNOLÓGICA DO ESTADO DO RIO DE JANEIRO,FAETERJ PARACAMBI,Pública Estadual,Faculdade,Sudeste,Rio de Janeiro
854,5052,FACULDADE DE EDUCAÇÃO TECNOLÓGICA DO ESTADO DO RIO DE JANEIRO - FAETERJ,FAETERJ TRÊS RIOS,Pública Estadual,Faculdade,Sudeste,Rio de Janeiro
855,1100,Centro Universitário Carlos Drummond de Andrade,UniDrummond,Privada sem fins lucrativos,Centro Universitário,Sudeste,São Paulo
856,2741,FACULDADE CATÓLICA DOM ORIONE,FACDO,Privada sem fins lucrativos,Faculdade,Norte,Tocantins
857,1362,CENTRO UNIVERSITÁRIO UBAENSE OZANAM COELHO,,Privada com fins lucrativos,Centro Universitário,Sudeste,Minas Gerais
858,1373,FACULDADE CASA BRANCA,FACAB,Privada com fins lucrativos,Faculdade,Sudeste,São Paulo
859,1375,FACULDADE CATÓLICA RAINHA DA PAZ DE ARAPUTANGA,FCARP,Privada sem fins lucrativos,Faculdade,Centro-Oeste,Mato Grosso
860,1381,Faculdade Martha Falcão Wyden,FMF Wyden,Privada com fins lucrativos,Faculdade,Norte,Amazonas
861,1780,FACULDADE HORIZONTINA,FAHOR,Privada sem fins lucrativos,Faculdade,Sul,Rio Grande do Sul
862,1382,Faculdades EST,EST,Privada sem fins lucrativos,Faculdade,Sul,Rio Grande do Sul
863,1383,FACULDADE JOSÉ LACERDA FILHO DE CIÊNCIAS APLICADAS,FAJOLCA,Privada sem fins lucrativos,Faculdade,Nordeste,Pernambuco
864,1384,FACULDADE SANTA HELENA,FSH,Privada sem fins lucrativos,Faculdade,Nordeste,Pernambuco
865,4211,Faculdade ESAMC São Paulo - ESAMC,ESAMC,Privada com fins lucrativos,Faculdade,Sudeste,São Paulo
866,1386,FACULDADE ESAMC CAMPINAS,ESAMC,Privada com fins lucrativos,Faculdade,Sudeste,São Paulo
867,17902,FACULDADE ESAMC JUNDIAÍ,ESAMC,Privada com fins lucrativos,Faculdade,Sudeste,São Paulo
868,1387,FACULDADE PENTÁGONO - FAPEN,FAPEN,Privada com fins lucrativos,Faculdade,Sudeste,São Paulo
869,1388,CENTRO UNIVERSITÁRIO SUMARÉ,,Privada com fins lucrativos,Centro Universitário,Sudeste,São Paulo
870,1395,FACULDADE DE CALDAS NOVAS,UNICALDAS,Privada com fins lucrativos,Faculdade,Centro-Oeste,Goiás
871,1396,Centro Universitário Dinâmica das Cataratas,UDC,Privada com fins lucrativos,Centro Universitário,Sul,Paraná
872,3193,FACULDADES INTEGRADAS DOS CAMPOS GERAIS,CESCAGE,Privada com fins lucrativos,Faculdade,Sul,Paraná
873,1401,FACULDADE ADELMAR ROSADO,FAR,Privada com fins lucrativos,Faculdade,Nordeste,Piauí
874,1402,INSTITUTO DE CIÊNCIAS SOCIAIS E HUMANAS,ICSH,Privada com fins lucrativos,Faculdade,Centro-Oeste,Goiás
875,1403,FACULDADE DE PIMENTA BUENO,FAP,Privada com fins lucrativos,Faculdade,Norte,Rondônia
876,1404,FACULDADE DE PIRACANJUBA,FAP,Privada com fins lucrativos,Faculdade,Centro-Oeste,Goiás
877,1409,FACULDADE DO CENTRO LESTE,UCL,Privada com fins lucrativos,Faculdade,Sudeste,Espírito Santo
878,17828,Faculdade do Centro Leste - Cariacica,UCL,Privada com fins lucrativos,Faculdade,Sudeste,Espírito Santo
879,1411,FACULDADE DOIS DE JULHO,F2J,Privada sem fins lucrativos,Faculdade,Nordeste,Bahia
880,1413,FACULDADE DE PRIMAVERA,CESPRI,Privada sem fins lucrativos,Faculdade,Sudeste,São Paulo
881,1414,CENTRO UNIVERSITÁRIO SÃO LUCAS,UniSL,Privada com fins lucrativos,Centro Universitário,Norte,Rondônia
882,1423,Faculdade Ideal Wyden,Faci Wyden,Privada com fins lucrativos,Faculdade,Norte,Pará
883,1427,CENTRO UNIVERSITÁRIO DA SERRA GAÚCHA,FSG,Privada com fins lucrativos,Centro Universitário,Sul,Rio Grande do Sul
884,12523,Faculdade da Serra Gaúcha de Bento Gonçalves,,Privada com fins lucrativos,Faculdade,Sul,Rio Grande do Sul
885,1429,FACULDADE BATISTA DO RIO DE JANEIRO,FABAT,Privada sem fins lucrativos,Faculdade,Sudeste,Rio de Janeiro
886,1430,CENTRO UNIVERSITÁRIO INGÁ,,Privada sem fins lucrativos,Centro Universitário,Sul,Paraná
887,1434,Centro Universitário de Itapira Uniesi,UNIESI,Privada com fins lucrativos,Centro Universitário,Sudeste,São Paulo
888,1436,ESCOLA SUPERIOR BATISTA DO AMAZONAS,ESBAM,Privada com fins lucrativos,Faculdade,Norte,Amazonas
889,1439,FACULDADE DE CIÊNCIAS ECONÔMICAS,FACAMP,Privada com fins lucrativos,Faculdade,Sudeste,São Paulo
890,1438,FACULDADE DE ADMINISTRAÇÃO DE EMPRESAS,FACAMP,Privada com fins lucrativos,Faculdade,Sudeste,São Paulo
891,1440,INSTITUTO APHONSIANO DE ENSINO SUPERIOR,IAESUP,Privada com fins lucrativos,Faculdade,Centro-Oeste,Goiás
892,1441,FACULDADE DE TECNOLOGIA DO PIAUÍ,FATEPI,Privada com fins lucrativos,Faculdade,Nordeste,Piauí
893,1841,CENTRO UNIVERSITÁRIO ANTÔNIO EUFRÁSIO DE TOLEDO DE PRESIDENTE PRUDENTE - TOLEDO PRUDENTE,TOLEDO PRUDENTE,Privada sem fins lucrativos,Centro Universitário,Sudeste,São Paulo
894,3602,CENTRO UNIVERSITÁRIO AUTÔNOMO DO BRASIL,UNIBRASIL,Privada com fins lucrativos,Centro Universitário,Sul,Paraná
895,1459,CENTRO UNIVERSITÁRIO MÁRIO PALMÉRIO,UNIFUCAMP,Privada sem fins lucrativos,Centro Universitário,Sudeste,Minas Gerais
896,1455,FACULDADE SANTÍSSIMO SACRAMENTO,FSSS,Privada sem fins lucrativos,Faculdade,Nordeste,Bahia
897,1454,FACULDADE SALESIANA DO NORDESTE,FASNE,Privada sem fins lucrativos,Faculdade,Nordeste,Pernambuco
898,1468,FACULDADE ESAMC UBERLÂNDIA,ESAMC,Privada com fins lucrativos,Faculdade,Sudeste,Minas Gerais
899,1469,FACULDADE CESUSC,,Privada com fins lucrativos,Faculdade,Sul,Santa Catarina
900,2632,FACULDADES INTEGRADAS DO EXTREMO SUL DA BAHIA,UNESULBAHIA,Privada sem fins lucrativos,Faculdade,Nordeste,Bahia
901,1494,CENTRO UNIVERSITÁRIO CATÓLICO DE VITÓRIA,,Privada sem fins lucrativos,Centro Universitário,Sudeste,Espírito Santo
902,1752,FACULDADE AUTÔNOMA DE DIREITO,FADISP,Privada com fins lucrativos,Faculdade,Sudeste,São Paulo
903,1493,CENTRO UNIVERSITÁRIO ALVES FARIA,UNIALFA,Privada com fins lucrativos,Centro Universitário,Centro-Oeste,Goiás
904,1491,CENTRO UNIVERSITÁRIO INTERNACIONAL,UNINTER,Privada com fins lucrativos,Centro Universitário,Sul,Paraná
905,20406,Faculdade Jaguar Indaiá,FJI,Privada com fins lucrativos,Faculdade,Sudeste,São Paulo
906,20465,Faculdade de Agronegócios de Holambra,FAAGROH,Privada com fins lucrativos,Faculdade,Sudeste,São Paulo
907,1490,CENTRO UNIVERSITÁRIO DE JAGUARIÚNA,UniFAJ,Privada com fins lucrativos,Centro Universitário,Sudeste,São Paulo
908,1488,FACULDADE LUSÓFONA DO RIO DE JANEIRO,FL-RJ,Privada com fins lucrativos,Faculdade,Sudeste,Rio de Janeiro
909,1487,CENTRO UNIVERSITÁRIO UNIDOM - BOSCO,UNIDOM - BOSCO,Privada com fins lucrativos,Centro Universitário,Sul,Paraná
910,18719,FACULDADE DE EDUCAÇÃO DE SANTA CATARINA,FAESC,Privada com fins lucrativos,Faculdade,Sul,Santa Catarina
